US-7912843-B2,Method for selecting electronic advertisements using machine translation techniques ,Yahoo! Inc.,"Vanessa Murdock, Massimiliano Ciaramita, Vassilis Plachouras",2007-10-29,2007-10-29,2011-03-22,2011-03-22,https://patents.google.com/patent/US7912843B2/en,https://patentimages.storage.googleapis.com/7d/06/19/5545fac682aafd/US07912843-20110322-D00000.png
US-8510238-B1,Method to predict session duration on mobile devices using native machine learning ,"Google, Inc.","Hrishikesh Aradhye, Ruei-Sung Lin",2012-06-22,2012-08-14,2013-08-13,2013-08-13,https://patents.google.com/patent/US8510238B1/en,https://patentimages.storage.googleapis.com/fb/a0/a9/8a0aeb7a201036/US08510238-20130813-D00000.png
US-8913827-B1,Image color correction with machine learning ,Google Inc.,Hui Fang,2010-05-10,2011-05-10,2014-12-16,2014-12-16,https://patents.google.com/patent/US8913827B1/en,https://patentimages.storage.googleapis.com/cd/40/a8/e341a9e3f2af9f/US08913827-20141216-D00000.png
US-9069737-B1,Machine learning based instance remediation ,"Amazon Technologies, Inc.","Laban Mwangi Kimotho, Jean-Paul Bauer",2013-07-15,2013-07-15,2015-06-30,2015-06-30,https://patents.google.com/patent/US9069737B1/en,https://patentimages.storage.googleapis.com/7d/52/2f/71d6733a365a26/US09069737-20150630-D00000.png
US-2007211064-A1,Processing machine learning techniques using a graphics processing unit ,Microsoft Corporation,"Ian Buck, Patrice Simard, David Steinkraus",2004-04-30,2007-05-14,2007-09-13,,https://patents.google.com/patent/US20070211064A1/en,https://patentimages.storage.googleapis.com/08/33/c0/331852af3289d1/US20070211064A1-20070913-D00000.png
US-2014205990-A1,Machine Learning for Student Engagement ,"Cloudvu, Inc.","Richard W. Wellman, Kelly D. Phillipps, David B. Gonzalez",2013-01-24,2013-01-24,2014-07-24,,https://patents.google.com/patent/US20140205990A1/en,https://patentimages.storage.googleapis.com/fa/21/6e/cbd53f5c8541d6/US20140205990A1-20140724-D00000.png
US-2015002628-A1,Depth camera system with machine learning for recognition of patches within a structured light pattern ,Dror Reif,Dror Reif,2013-06-27,2013-06-27,2015-01-01,,https://patents.google.com/patent/US20150002628A1/en,https://patentimages.storage.googleapis.com/15/17/5c/96bb65ceeb37e6/US20150002628A1-20150101-D00000.png
US-2012154373-A1,Parallel processing machine learning decision tree training ,Microsoft Corporation,"Mark Finocchio, Richard E. Moore, Ryan M. Geiss, Jamie Shotton",2010-12-15,2010-12-15,2012-06-21,,https://patents.google.com/patent/US20120154373A1/en,https://patentimages.storage.googleapis.com/7f/49/ff/dcce744f4a7f56/US20120154373A1-20120621-D00000.png
US-2014297571-A1,Justifying Passage Machine Learning for Question and Answer Systems ,International Business Machines Corporation,"Bridget B. Beamon, Michael D. Whitley, Robert L. Yates",2013-03-29,2014-03-28,2014-10-02,,https://patents.google.com/patent/US20140297571A1/en,https://patentimages.storage.googleapis.com/c4/01/1b/86f60dc76f11d4/US20140297571A1-20141002-D00000.png
US-2010292838-A1,Machine Learning Approach for Predicting Humanoid Robot Fall ,"Honda Motor Co., Ltd.","Ambarish Goswami, Shivaram Kalyanakrishnan",2009-05-15,2010-01-29,2010-11-18,,https://patents.google.com/patent/US20100292838A1/en,https://patentimages.storage.googleapis.com/fc/e7/e1/09a4d358e24b14/US20100292838A1-20101118-D00000.png
US-2015200899-A1,Automatic email reminder system based on machine learning ,Google Inc.,Pannag Raghunath Sanketi,2013-01-29,2013-01-29,2015-07-16,,https://patents.google.com/patent/US20150200899A1/en,https://patentimages.storage.googleapis.com/24/9f/d5/fb7a110b1edf67/US20150200899A1-20150716-D00000.png
US-8275600-B2,Machine learning for transliteration ,Google Inc.,"Slaven Bilac, Hiroshi Ichikawa",2008-10-10,2009-01-21,2012-09-25,2012-09-25,https://patents.google.com/patent/US8275600B2/en,https://patentimages.storage.googleapis.com/ca/68/ed/e77757560ea586/US08275600-20120925-D00000.png
CN-102750695-A,Machine learning-based stereoscopic image quality objective assessment method ,清华大学,"戴琼海, 曹汛, 王好谦, 马潇",2012-06-04,2012-06-04,2012-10-24,,https://patents.google.com/patent/CN102750695A/en,
US-7406452-B2,Machine learning ,"Hewlett-Packard Development Company, L.P.","George Henry Forman, Stephane Chiocchetti",2005-03-17,2005-03-17,2008-07-29,2008-07-29,https://patents.google.com/patent/US7406452B2/en,https://patentimages.storage.googleapis.com/US7406452B2/US07406452-20080729-D00000.png
US-8478535-B2,Systems and methods that utilize machine learning algorithms to facilitate assembly of aids vaccine cocktails ,Microsoft Corporation,"Nebojsa Jojic, Vladimir Jojic, David E. Heckerman, Brendan John Frey, Christopher A. Meek",2004-10-29,2005-12-30,2013-07-02,2013-07-02,https://patents.google.com/patent/US8478535B2/en,https://patentimages.storage.googleapis.com/02/96/a5/032a1cc0389232/US08478535-20130702-D00001.png
US-9477652-B2,Machine learning dialect identification ,"Facebook, Inc.",Fei Huang,2015-02-13,2015-02-13,2016-10-25,2016-10-25,https://patents.google.com/patent/US9477652B2/en,https://patentimages.storage.googleapis.com/63/e8/0c/14a6a8ef40d5d7/US09477652-20161025-D00000.png
US-2014372346-A1,Data intelligence using machine learning ,"Purepredictive, Inc.","Kelly D. Phillipps, Richard W. Wellman, Sardar Monsurur Rahman, Matthew B. Phillipps",2013-06-17,2014-04-30,2014-12-18,,https://patents.google.com/patent/US20140372346A1/en,https://patentimages.storage.googleapis.com/9b/1c/5a/86dfa7a22242a5/US20140372346A1-20141218-D00000.png
US-2014075336-A1,Adaptive user interface using machine learning model ,"Mike Curtis, John Fremlin, Shashank Pandit","Mike Curtis, John Fremlin, Shashank Pandit",2012-09-12,2012-09-12,2014-03-13,,https://patents.google.com/patent/US20140075336A1/en,https://patentimages.storage.googleapis.com/79/a6/cd/cd56515659abc2/US20140075336A1-20140313-D00000.png
US-2014337257-A1,Hybrid human machine learning system and method ,"Metavana, Inc.","Manjirnath Chatterjee, Rabia TURAN, Brian Lue, Ankur Agrawal, Kevin PERILLO",2013-05-09,2014-05-09,2014-11-13,,https://patents.google.com/patent/US20140337257A1/en,https://patentimages.storage.googleapis.com/8e/7f/63/6c1af61839bc27/US20140337257A1-20141113-D00000.png
US-2015379425-A1,Consistent filtering of machine learning data ,"Amazon Technologies, Inc.","Leo Parker Dirac, Jin Li, Tianming Zheng, Donghui Zhuo",2014-06-30,2014-08-14,2015-12-31,,https://patents.google.com/patent/US20150379425A1/en,https://patentimages.storage.googleapis.com/a7/f6/bb/b125177a63e417/US20150379425A1-20151231-D00000.png
US-2009240539-A1,Machine learning system for a task brokerage system ,Microsoft Corporation,"Dean A. Slawson, Raman Chandrasekar, Vikram Dendi",2008-03-21,2008-03-21,2009-09-24,,https://patents.google.com/patent/US20090240539A1/en,https://patentimages.storage.googleapis.com/US20090240539A1/US20090240539A1-20090924-D00000.png
US-2010223214-A1,Automatic extraction using machine learning based robust structural extractors ,"Kirpal Alok S, Sandeepkumar Bhuramal Satpal, Meghana Kshirsagar, Sengamedu Srinivasan H","Alok S. Kirpal, Sandeepkumar Bhuramal Satpal, Meghana Kshirsagar, Srinivasan H. Sengamedu",2009-02-27,2009-02-27,2010-09-02,,https://patents.google.com/patent/US20100223214A1/en,https://patentimages.storage.googleapis.com/US20100223214A1/US20100223214A1-20100902-D00000.png
WO-9802825-A2,Computer implemented machine learning method and system ,Francone Frank D,"Frank D. Francone, Peter Nordin, Wolfgang Banzhaf",1996-07-12,1997-07-10,1998-01-22,,https://patents.google.com/patent/WO1998002825A2/en,
US-2015100530-A1,Methods and apparatus for reinforcement learning ,Google Inc.,"Volodymyr Mnih, Koray Kavukcuoglu",2013-10-08,2013-12-05,2015-04-09,,https://patents.google.com/patent/US20150100530A1/en,https://patentimages.storage.googleapis.com/05/fd/4b/dcc15ba3580e01/US20150100530A1-20150409-D00000.png
US-2014025613-A1,Apparatus and methods for reinforcement learning in large populations of artificial spiking neurons ,Filip Ponulak,Filip Ponulak,2012-07-20,2012-07-20,2014-01-23,,https://patents.google.com/patent/US20140025613A1/en,https://patentimages.storage.googleapis.com/b3/14/1c/18833269b8786b/US20140025613A1-20140123-D00000.png
US-2006009966-A1,Method and system for extracting information from unstructured text using symbolic machine learning ,International Business Machines Corporation,"David Johnson, Frank Oles",2004-07-12,2004-11-03,2006-01-12,,https://patents.google.com/patent/US20060009966A1/en,https://patentimages.storage.googleapis.com/99/eb/ac/2a4173acfe9293/US20060009966A1-20060112-D00000.png
US-2014051959-A1,Machine learning in determining catheter electrode contact ,"Vadim Gliner, Assaf Govari","Vadim Gliner, Assaf Govari",2012-08-20,2012-08-20,2014-02-20,,https://patents.google.com/patent/US20140051959A1/en,https://patentimages.storage.googleapis.com/dd/d1/e3/afbbefa2e26502/US20140051959A1-20140220-D00000.png
US-2005192914-A1,Selecting a profile model for use in optical metrology using a machine learining system ,"Timbre Technologies, Inc.","Emmanuel Drege, Srinivas Doddi, Junwei Bao",2004-03-01,2004-03-01,2005-09-01,,https://patents.google.com/patent/US20050192914A1/en,https://patentimages.storage.googleapis.com/d9/45/fe/3b43a6d9aed75e/US20050192914A1-20050901-D00000.png
CN-102968646-A,Plate number detecting method based on machine learning ,华中科技大学,"王润民, 桑农, 王岳环, 罗大鹏, 宋萌萌, 党小迪, 傅慧妮, 谢晓民",2012-10-25,2012-10-25,2013-03-13,,https://patents.google.com/patent/CN102968646A/en,
US-2016110657-A1,Configurable Machine Learning Method Selection and Parameter Optimization System and Method ,"Skytree, Inc.","Maxsim Gibiansky, Ryan Riegel, Yi Yang, Parikshit Ram, Alexander Gray",2014-10-14,2015-10-14,2016-04-21,,https://patents.google.com/patent/US20160110657A1/en,https://patentimages.storage.googleapis.com/50/17/58/2329fda982beb0/US20160110657A1-20160421-D00000.png
US-2012263376-A1,Supervised and semi-supervised online boosting algorithm in machine learning framework ,"Sharp Laboratories Of America, Inc.","Fan Wang, Xinyu Xu, Chang Yuan, Petrus J.L. van Beek",2011-04-12,2011-04-12,2012-10-18,,https://patents.google.com/patent/US20120263376A1/en,https://patentimages.storage.googleapis.com/93/5a/1e/893642369609be/US20120263376A1-20121018-D00000.png
US-2008282108-A1,Program synthesis and debugging using machine learning techniques ,Microsoft Corporation,"Vladimir Jojic, Nebojsa Jojic, Sumit Gulwani",2007-05-07,2007-05-07,2008-11-13,,https://patents.google.com/patent/US20080282108A1/en,https://patentimages.storage.googleapis.com/US20080282108A1/US20080282108A1-20081113-D00000.png
US-2012253927-A1,Machine learning approach for determining quality scores ,Microsoft Corporation,"Tao Qin, Tie-Yan Liu, Bin Gao, Jingyi Xu, Zeyong Xu, Wei-Ying Ma",2011-04-01,2011-04-01,2012-10-04,,https://patents.google.com/patent/US20120253927A1/en,https://patentimages.storage.googleapis.com/32/7b/75/047bcd14b12d60/US20120253927A1-20121004-D00000.png
US-2008025596-A1,System and Method for Machine Learning using a Similarity Inverse Matrix ,"D&S Consultants, Inc.",Christine Podilchuk,2006-06-12,2007-01-02,2008-01-31,,https://patents.google.com/patent/US20080025596A1/en,https://patentimages.storage.googleapis.com/5e/55/e4/ce069c7cf99865/US20080025596A1-20080131-D00000.png
US-2006262115-A1,Statistical machine learning system and methods ,Shapiro Graham H,Graham Shapiro,2005-05-02,2006-05-01,2006-11-23,,https://patents.google.com/patent/US20060262115A1/en,https://patentimages.storage.googleapis.com/70/c8/21/1bda1675763ed5/US20060262115A1-20061123-D00000.png
US-2011307424-A1,Determination of training set size for a machine learning system ,"Wen Jin, Vi Vuong, Walter Dean Mieher","Wen Jin, Vi Vuong, Walter Dean Mieher",2010-06-10,2010-06-10,2011-12-15,,https://patents.google.com/patent/US20110307424A1/en,https://patentimages.storage.googleapis.com/0d/67/70/11bda242f9f1b4/US20110307424A1-20111215-D00000.png
US-2010192195-A1,"Managing security configuration through machine learning, combinatorial optimization and attack graphs ","Dunagan John D, Alice Xiao-Zhou Zheng","John D. Dunagan, Alice Xiao-Zhou Zheng",2009-01-26,2009-01-26,2010-07-29,,https://patents.google.com/patent/US20100192195A1/en,
US-8036996-B2,Systems and methods for martingale boosting in machine learning ,The Trustees Of Columbia University In The City Of New York,"Philip M. Long, Rocco A. Servedio, Roger N. Anderson, Albert Boulanger",2005-09-13,2008-03-10,2011-10-11,2011-10-11,https://patents.google.com/patent/US8036996B2/en,https://patentimages.storage.googleapis.com/d3/2e/08/e3769eafe6db01/US08036996-20111011-D00000.png
US-8788439-B2,Instance weighted learning machine learning model ,"InsideSales.com, Inc.","Tony Ramon Martinez, Xinchuan Zeng",2012-12-21,2012-12-21,2014-07-22,2014-07-22,https://patents.google.com/patent/US8788439B2/en,https://patentimages.storage.googleapis.com/2f/99/54/f1b0c9e19f89a8/US08788439-20140722-D00000.png
US-2008243730-A1,Training a machine learning system to determine photoresist parameters ,Tokyo Electron Limited,"Joerg Bischoff, David Hetzer, Manuel Madriaga",2007-03-28,2007-03-28,2008-10-02,,https://patents.google.com/patent/US20080243730A1/en,
US-2013028487-A1,Computer vision and machine learning software for grading and sorting plants ,Carnegie Mellon University,"David Jonathan Stager, Michael Knoll Sergi-Curfman, David Arthur LaRose, Christopher Chandler Fromme, James Andrew Bagnell, Elliot Allen Cuzzillo, L. Douglas Baker",2010-03-13,2011-03-14,2013-01-31,,https://patents.google.com/patent/US20130028487A1/en,https://patentimages.storage.googleapis.com/91/73/8b/acac8f00f79768/US20130028487A1-20130131-D00000.png
CN-103871079-A,Vehicle tracking method based on machine learning and optical flow ,南京金智视讯技术有限公司,骞森,2014-03-18,2014-03-18,2014-06-18,,https://patents.google.com/patent/CN103871079A/en,
CN-101980211-A,Machine learning model and establishing method thereof ,百度在线网络技术（北京）有限公司,"�田�浩, 万伟",2010-11-12,2010-11-12,2011-02-23,,https://patents.google.com/patent/CN101980211A/en,
CN-103793484-A,Fraudulent conduct identification system based on machine learning in classified information website ,五八同城信息技术有限公司,"张鹏, 张爱华, 张美琦, 张朝阳, 孙亚健",2014-01-17,2014-01-17,2014-05-14,,https://patents.google.com/patent/CN103793484A/en,
US-2008080768-A1,Machine learning based triple region segmentation framework using level set on pacs ,General Electric Company,"Shou Li, Sukhdeep Gill, David William Roeder, Prakash Mahesh",2006-09-29,2007-09-13,2008-04-03,,https://patents.google.com/patent/US20080080768A1/en,
US-2008154565-A1,Automatic organ detection using machine learning and classification algorithms ,"Siemens Corporate Research, Inc.","Charles Florin, James Williams",2006-05-23,2007-05-14,2008-06-26,,https://patents.google.com/patent/US20080154565A1/en,
US-2013346346-A1,Semi-supervised random decision forests for machine learning ,Microsoft Corporation,"Antonio Criminisi, Jamie Daniel Joseph Shotton",2012-06-21,2012-06-21,2013-12-26,,https://patents.google.com/patent/US20130346346A1/en,https://patentimages.storage.googleapis.com/1f/bc/40/f2d74ad2451f05/US20130346346A1-20131226-D00000.png
CN-101738981-A,Machine learning-based robot grinding method ,清华大学,"宋亦旭, 杨泽红, 梁伟, 贾培发",2009-12-04,2009-12-04,2010-06-16,,https://patents.google.com/patent/CN101738981A/en,
US-2006190226-A1,Systems and methods that utilize machine learning algorithms to facilitate assembly of aids vaccine cocktails ,Microsoft Corporation,"Nebojsa Jojic, Vladimir Jojic, David Heckerman, Brendan Frey, Christopher Meek",2004-10-29,2005-12-30,2006-08-24,,https://patents.google.com/patent/US20060190226A1/en,https://patentimages.storage.googleapis.com/c4/12/2d/b1486370147d6c/US20060190226A1-20060824-D00000.png
US-8352389-B1,Multiple output relaxation machine learning model ,Insidesales.com,"Tony Ramon Martinez, Xinchuan Zheng",2012-08-20,2012-08-20,2013-01-08,2013-01-08,https://patents.google.com/patent/US8352389B1/en,https://patentimages.storage.googleapis.com/4d/9b/5f/0d436fd3ad11d3/US08352389-20130108-D00000.png
US-9324022-B2,Classifying data with deep learning neural records incrementally refined through expert input ,"Signal/Sense, Inc.","David Russell Williams, Jr., Luke Robert Gutzwiller, Megan Ursula Hazen, Brigham Sterling Anderson, Alan McIntyre, Tom Abeles",2014-03-04,2015-03-04,2016-04-26,2016-04-26,https://patents.google.com/patent/US9324022B2/en,https://patentimages.storage.googleapis.com/34/1b/a9/280b5ae6e041ed/US09324022-20160426-D00000.png
CN-102662923-A,Entity instance leading method based on machine learning ,天津大学,"张萌, 王文俊",2012-04-23,2012-04-23,2012-09-12,,https://patents.google.com/patent/CN102662923A/en,
US-2012269420-A1,Image Processing and Machine Learning for Diagnostic Analysis of Microcirculation ,"Kayvan Najarian, Rosalyn Stacy Hobson, Ward Kevin R, Sumeyra Ummuhan Demir Kanik, Nazanin Mirshahi","Kayvan Najarian, Rosalyn Stacy Hobson, Kevin R. Ward, Sumeyra Ummuhan Demir Kanik, Nazanin Mirshahi",2009-04-07,2010-03-17,2012-10-25,,https://patents.google.com/patent/US20120269420A1/en,https://patentimages.storage.googleapis.com/a3/c1/b6/bc37e68cbd1d5f/US20120269420A1-20121025-D00000.png
US-2016132787-A1,"Distributed, multi-model, self-learning platform for machine learning ",Massachusetts Institute Of Technology,"Will D. Drevo, Kalyan K. Veeramachaneni, Una-May O'Reilly",2014-11-11,2015-01-16,2016-05-12,,https://patents.google.com/patent/US20160132787A1/en,https://patentimages.storage.googleapis.com/5f/98/26/0cf28d33660999/US20160132787A1-20160512-D00000.png
US-2016071022-A1,Machine Learning Model for Level-Based Categorization of Natural Language Parameters ,International Business Machines Corporation,"Nicholas V. Bruno, Donna K. Byron, Julius Goth, Iii, Dwi Sianto Mansjur",2014-09-04,2014-09-04,2016-03-10,,https://patents.google.com/patent/US20160071022A1/en,https://patentimages.storage.googleapis.com/9a/35/32/37727b10ed7473/US20160071022A1-20160310-D00000.png
US-2015379424-A1,Machine learning service ,"Amazon Technologies, Inc.","Leo Parker Dirac, Nicolle M. Correa, Aleksandr Mikhaylovich Ingerman, Sriram Krishnan, Jin Li, Sudhakar Rao Puvvadi, Saman Zarandioon",2014-06-30,2014-06-30,2015-12-31,,https://patents.google.com/patent/US20150379424A1/en,https://patentimages.storage.googleapis.com/b7/3c/e2/05baea494fd2c4/US20150379424A1-20151231-D00000.png
US-2010169245-A1,Statistical Machine Learning ,Sap Ag,"Binyamin Basel, Yizhak Idan",2008-12-31,2008-12-31,2010-07-01,,https://patents.google.com/patent/US20100169245A1/en,https://patentimages.storage.googleapis.com/US20100169245A1/US20100169245A1-20100701-D00000.png
US-2010036780-A1,Machine learning ,The University Of Lancaster,Plamen Angelov,2006-11-01,2007-10-23,2010-02-11,,https://patents.google.com/patent/US20100036780A1/en,
US-2008025231-A1,Machine learning approach for estimating a network path property ,"Puneet Sharma, Rita Wouhaybi, Sujata Banerjee","Puneet Sharma, Rita Wouhaybi, Sujata Banerjee",2006-07-31,2006-07-31,2008-01-31,,https://patents.google.com/patent/US20080025231A1/en,https://patentimages.storage.googleapis.com/US20080025231A1/US20080025231A1-20080131-D00000.png
US-2005071300-A1,Kernels and methods for selecting kernels for use in learning machines ,"Bartlett Peter L, Andre Elisseeff, Bernard Schoelkopf","Peter Bartlett, Andre Elisseeff, Bernard Schoelkopf",2001-05-07,2002-05-07,2005-03-31,,https://patents.google.com/patent/US20050071300A1/en,https://patentimages.storage.googleapis.com/af/bc/95/da17145749bfdb/US20050071300A1-20050331-D00000.png
US-2007094171-A1,Training a learning system with arbitrary cost functions ,Microsoft Corporation,"Christopher Burges, Yevgeny Agichtein",2005-07-18,2005-12-16,2007-04-26,,https://patents.google.com/patent/US20070094171A1/en,https://patentimages.storage.googleapis.com/5a/68/7e/124f76683611e8/US20070094171A1-20070426-D00000.png
US-8798969-B2,Machine learning for a memory-based database ,Sap Ag,Robert Heidasch,2012-03-28,2012-03-28,2014-08-05,2014-08-05,https://patents.google.com/patent/US8798969B2/en,https://patentimages.storage.googleapis.com/6f/7d/d4/f91cf504e08b69/US08798969-20140805-D00000.png
US-7437334-B2,Preparing data for machine learning ,"Hewlett-Packard Development Company, L.P.","George H. Forman, Stephane Chiocchetti",2004-12-03,2004-12-03,2008-10-14,2008-10-14,https://patents.google.com/patent/US7437334B2/en,https://patentimages.storage.googleapis.com/US7437334B2/US07437334-20081014-D00000.png
WO-2013121181-A1,Method of machine learning classes of search queries ,British Sky Broadcasting Limited,Simon John DRISCOLL,2012-02-14,2013-02-08,2013-08-22,,https://patents.google.com/patent/WO2013121181A1/en,
US-8019704-B1,Scaling machine learning using approximate counting ,Google Inc.,"Simon Tong, Noam Shazeer",2007-05-16,2010-05-12,2011-09-13,2011-09-13,https://patents.google.com/patent/US8019704B1/en,https://patentimages.storage.googleapis.com/d9/72/f3/6ae077b9562402/US08019704-20110913-D00000.png
WO-0157732-A1,Machine learning interface for customizing a web browser ,"Starlab, N.V.","Richard Wheeler, Johan Kaers",2000-02-01,2001-02-01,2001-08-09,,https://patents.google.com/patent/WO2001057732A1/en,
US-2010223213-A1,System and method for parallelization of machine learning computing code ,"Optillel Solutions, Inc.","Jimmy Zhigang Su, Archana Ganapathi, Mark Rotblat",2009-02-27,2009-02-27,2010-09-02,,https://patents.google.com/patent/US20100223213A1/en,https://patentimages.storage.googleapis.com/US20100223213A1/US20100223213A1-20100902-D00000.png
US-2016042511-A1,Tissue Object-Based Machine Learning System for Automated Scoring of Digital Whole Slides ,"Ventana Medical Systems, Inc.","Srinivas Chukka, Sujit Siddheshwar Chivate, Suhas Hanmantrao Patil, Bikash Sabata, Olcay Sertel, Anindya Sarkar",2013-03-15,2014-03-12,2016-02-11,,https://patents.google.com/patent/US20160042511A1/en,https://patentimages.storage.googleapis.com/bd/e4/d3/a5b48b7635a836/US20160042511A1-20160211-D00000.png
US-2014258187-A1,Generating database cluster health alerts using machine learning ,Oracle International Corporation,"Yaser Ib Suleiman, Michael Zoll, Angelo Pruscino",2013-03-08,2013-03-08,2014-09-11,,https://patents.google.com/patent/US20140258187A1/en,https://patentimages.storage.googleapis.com/54/5c/c9/fea8a33ccdbdad/US20140258187A1-20140911-D00000.png
US-9008416-B2,Collection of machine learning training data for expression recognition ,"Emotient, Inc.","Javier Movellan, Marian Steward Bartlett, Ian Fasel, Gwen Ford LITTLEWORT, Joshua SUSSKIND, Jacob WHITEHILL",2013-02-08,2014-02-10,2015-04-14,2015-04-14,https://patents.google.com/patent/US9008416B2/en,https://patentimages.storage.googleapis.com/68/f8/e6/97077783eb0e0e/US09008416-20150414-D00000.png
US-7599893-B2,Methods and systems for feature selection in machine learning based on feature contribution and model fitness ,"Aureon Laboratories, Inc.","Marina Sapir, Faisal M. Khan, David A. Verbel, Olivier Saidi",2005-10-13,2006-05-22,2009-10-06,2009-10-06,https://patents.google.com/patent/US7599893B2/en,https://patentimages.storage.googleapis.com/US7599893B2/US07599893-20091006-D00000.png
US-2009116737-A1,Machine Learning For Tissue Labeling Segmentation ,"Siemens Corporate Research, Inc.","Atilla Peter Kiraly, Christopher V. Alvino, Hong Shen",2007-10-30,2008-10-30,2009-05-07,,https://patents.google.com/patent/US20090116737A1/en,https://patentimages.storage.googleapis.com/72/84/3b/c260fa53f236ee/US20090116737A1-20090507-D00003.png
US-9348920-B1,Concept indexing among database of documents using machine learning techniques ,Palantir Technologies Inc.,Max KESIN,2014-12-22,2015-06-22,2016-05-24,2016-05-24,https://patents.google.com/patent/US9348920B1/en,https://patentimages.storage.googleapis.com/dd/4e/bf/7bb4ee27bdf8f1/US09348920-20160524-D00000.png
US-2015279036-A1,Side window detection in near-infrared images utilizing machine learning ,Xerox Corporation,"Yusuf Artan, Peter Paul",2014-04-01,2014-04-01,2015-10-01,,https://patents.google.com/patent/US20150279036A1/en,https://patentimages.storage.googleapis.com/29/da/9e/5d2439a7728bb8/US20150279036A1-20151001-D00000.png
US-2011022552-A1,Systems and Methods for Implementing a Machine-Learning Agent to Retrieve Information in Response to a Message ,Carnegie Mellon University,"John Zimmerman, Anthony Tomasic, Ian Hargraves",2009-07-22,2010-07-22,2011-01-27,,https://patents.google.com/patent/US20110022552A1/en,https://patentimages.storage.googleapis.com/4c/52/38/10a611d7321845/US20110022552A1-20110127-D00000.png
US-2014236875-A1,Machine learning for real-time adaptive website interaction ,"Purepredictive, Inc.","Kelly D. Phillipps, Richard W. Wellman, James T. Lovell",2012-11-15,2014-04-30,2014-08-21,,https://patents.google.com/patent/US20140236875A1/en,https://patentimages.storage.googleapis.com/32/d6/ff/ad121f17632191/US20140236875A1-20140821-D00000.png
US-2016300049-A1,Machine-learning behavioral analysis to detect device theft and unauthorized device usage ,Qualcomm Incorporated,"Isaac David Guedalia, Adam Schwartz",2015-04-09,2015-04-09,2016-10-13,,https://patents.google.com/patent/US20160300049A1/en,https://patentimages.storage.googleapis.com/56/c8/0f/14d68c45398195/US20160300049A1-20161013-D00000.png
US-7002974-B1,Learning state machine for use in internet protocol networks ,Netrake Corporation,"James Robert Deerman, Aswinkumar Vishanji Rana, Milton Andre Lie, Travis Ernest Strother, Jr., Mark Warden Hervin, John Raymond Carman, Larry Gene Maxwell, Robert Daniel Maher, III",2001-03-28,2001-03-28,2006-02-21,2006-02-21,https://patents.google.com/patent/US7002974B1/en,https://patentimages.storage.googleapis.com/US7002974B1/US07002974-20060221-D00000.png
