US-2013272570-A1,Robust and efficient learning object tracker ,Qualcomm Incorporated,"Tao Sheng, Alwyn Dos Remedios",2012-04-16,2013-03-12,2013-10-17,,https://patents.google.com/patent/US20130272570A1/en,https://patentimages.storage.googleapis.com/5f/fa/1a/adf6b03ee530da/US20130272570A1-20131017-D00000.png
US-2005131847-A1,Pre-processed feature ranking for a support vector machine ,"Jason Weston, Andre Elisseeff, Bernhard Scholkopf, Fernando Perez-Cruz, Isabelle Guyon","Jason Weston, Andre Elisseeff, Bernhard Scholkopf, Fernando Perez-Cruz, Isabelle Guyon",1998-05-01,2002-11-07,2005-06-16,,https://patents.google.com/patent/US20050131847A1/en,https://patentimages.storage.googleapis.com/3f/c2/85/9b883cd6700d6c/US20050131847A1-20050616-D00000.png
US-6842751-B1,Methods and apparatus for selecting a data classification model using meta-learning ,International Business Machines Corporation,"Ricardo Vilalta, Irina Rish",2000-07-31,2000-07-31,2005-01-11,2005-01-11,https://patents.google.com/patent/US6842751B1/en,https://patentimages.storage.googleapis.com/c4/8e/c6/77447022254556/US06842751-20050111-D00000.png
US-2013117212-A1,"Methods and apparatus for unsupervised neural replay, learning refinement, association and memory transfer: neural associative learning, pattern completion, separation, generalization and hierarchical replay ",Qualcomm Incorporated,"Jason Frank Hunzinger, Victor Hokkiu Chan",2011-11-09,2011-11-09,2013-05-09,,https://patents.google.com/patent/US20130117212A1/en,https://patentimages.storage.googleapis.com/5c/bb/70/c883b6955ea5f8/US20130117212A1-20130509-D00000.png
US-5608843-A,Learning controller with advantage updating algorithm ,The United States Of America As Represented By The Secretary Of The Air Force,"Leemon C. Baird, III",1994-08-01,1994-08-01,1997-03-04,1997-03-04,https://patents.google.com/patent/US5608843A/en,https://patentimages.storage.googleapis.com/pages/US5608843-1.png
US-6735748-B1,Method and apparatus for performing extraction using a model trained with bayesian inference ,"Cadence Design Systems, Inc.","Steven Teig, Arindam Chatterjee",2001-08-28,2002-01-31,2004-05-11,2004-05-11,https://patents.google.com/patent/US6735748B1/en,https://patentimages.storage.googleapis.com/21/47/12/882af6b97a6a12/US06735748-20040511-D00000.png
US-2012284080-A1,Customer cognitive style prediction model based on mobile behavioral profile ,Telefonica S.A.,"Rodrigo De Oliveira, Ana ARMENTA, Pedro CONCEJERO, Cesar Martin GUERRA-SALCEDO, Alexandros KARATZOGLOU, Nuria Oliver, Rubén LARA",2011-05-04,2011-07-07,2012-11-08,,https://patents.google.com/patent/US20120284080A1/en,https://patentimages.storage.googleapis.com/c7/a5/e0/e30f292951d9ad/US20120284080A1-20121108-D00000.png
US-2006143254-A1,System and method for using anchor text as training data for classifier-based search systems ,Microsoft Corporation,"Harr Chen, Adwait Ratnaparkhi, Sonja Knoll, Hsiao-Wuen Hon",2004-12-24,2004-12-24,2006-06-29,,https://patents.google.com/patent/US20060143254A1/en,https://patentimages.storage.googleapis.com/70/79/14/cc779a101e2a5f/US20060143254A1-20060629-D00000.png
US-2010333089-A1,Coordinated reliability management of virtual machines in a virtualized system ,"Vanish Talwar, Sanjay Kumar, Parthasarathy Ranganathan","Vanish Talwar, Sanjay Kumar, Parthasarathy Ranganathan",2009-06-29,2009-06-29,2010-12-30,,https://patents.google.com/patent/US20100333089A1/en,https://patentimages.storage.googleapis.com/US20100333089A1/US20100333089A1-20101230-D00000.png
US-2005080782-A1,Computer aided query to task mapping ,Microsoft Corporation,"Adwait Ratnaparkhi, Robert Ragno, Felipe Naranjo, Boris Gorodnitsky",2003-10-10,2003-10-10,2005-04-14,,https://patents.google.com/patent/US20050080782A1/en,https://patentimages.storage.googleapis.com/4c/7e/36/e23e6fe57a3bce/US20050080782A1-20050414-D00000.png
US-2014112556-A1,Multi-modal sensor based emotion recognition and emotional interface ,Sony Computer Entertainment Inc.,Ozlem Kalinli-Akbacak,2012-10-19,2012-10-19,2014-04-24,,https://patents.google.com/patent/US20140112556A1/en,https://patentimages.storage.googleapis.com/1e/1f/98/73c4f515add63f/US20140112556A1-20140424-D00000.png
US-2010179930-A1,Method and System for Developing Predictions from Disparate Data Sources Using Intelligent Processing ,"Eric Teller, Dave Andre, John Stivoric","Eric Teller, Dave Andre, John Stivoric",2009-01-13,2009-01-13,2010-07-15,,https://patents.google.com/patent/US20100179930A1/en,https://patentimages.storage.googleapis.com/US20100179930A1/US20100179930A1-20100715-D00000.png
US-2007294768-A1,"Method and system for detecting malicious behavioral patterns in a computer, using machine learning ",Deutsche Telekom Ag,"Robert Moskovitch, Dima Stopel, Zvi Boger, Yuval Shahar, Yuval Elovici",2006-01-31,2007-01-29,2007-12-20,,https://patents.google.com/patent/US20070294768A1/en,https://patentimages.storage.googleapis.com/eb/d6/9e/a0d54faa343508/US20070294768A1-20071220-D00000.png
US-2012209794-A1,Self-organizing sequential memory pattern machine and reinforcement learning method ,Jones Iii Robert Linzey,"Robert Linzey Jones, III",2011-02-15,2011-02-15,2012-08-16,,https://patents.google.com/patent/US20120209794A1/en,https://patentimages.storage.googleapis.com/ab/d4/00/6fc6d97b7db69e/US20120209794A1-20120816-D00000.png
US-2010086215-A1,Automated Facial Action Coding System ,"Marian Steward Bartlett, Gwen Littlewort-Ford, Javier Movellan, Ian Fasel, Mark Frank","Marian Steward Bartlett, Gwen Littlewort-Ford, Javier Movellan, Ian Fasel, Mark Frank",2008-08-26,2009-08-26,2010-04-08,,https://patents.google.com/patent/US20100086215A1/en,https://patentimages.storage.googleapis.com/US20100086215A1/US20100086215A1-20100408-D00000.png
US-2015347820-A1,Learning Deep Face Representation ,"Beijing Kuangshi Technology Co., Ltd.","Qi Yin, Zhimin Cao, Yuning Jiang, Haoqiang Fan",2014-05-27,2014-05-27,2015-12-03,,https://patents.google.com/patent/US20150347820A1/en,https://patentimages.storage.googleapis.com/72/c9/1d/8a89bcf3e7cf6d/US20150347820A1-20151203-D00000.png
US-2008059389-A1,Sequence learning in a hierarchical temporal memory based system ,"Jaros Robert G, Dileep George, Jeffrey Hawkins, Frank Astier","Robert Jaros, Dileep George, Jeffrey Hawkins, Frank Astier",2006-02-10,2007-01-11,2008-03-06,,https://patents.google.com/patent/US20080059389A1/en,https://patentimages.storage.googleapis.com/38/51/16/1dc0c255951979/US20080059389A1-20080306-D00000.png
US-2008154577-A1,Chunk-based statistical machine translation system ,"Sehda,Inc.","Yookyung Kim, Jun Huang, Youssef Billawala",2006-12-26,2006-12-26,2008-06-26,,https://patents.google.com/patent/US20080154577A1/en,
US-2007150801-A1,Interactive learning-based document annotation ,Xerox Corporation,"Boris Chidlovskii, Thierry Jacquin",2005-12-23,2005-12-23,2007-06-28,,https://patents.google.com/patent/US20070150801A1/en,https://patentimages.storage.googleapis.com/US20070150801A1/US20070150801A1-20070628-D00000.png
US-9547821-B1,Deep learning for algorithm portfolios ,International Business Machines Corporation,"Andrea Loreggia, Yuri Malitsky, Horst C. Samulowitz, Vijay A. Saraswat",2016-02-04,2016-02-04,2017-01-17,2017-01-17,https://patents.google.com/patent/US9547821B1/en,https://patentimages.storage.googleapis.com/6e/47/69/201d2222b579e2/US09547821-20170117-D00000.png
US-2012101804-A1,Machine translation using overlapping biphrase alignments and sampling ,Xerox Corporation,"Benjamin Roth, Andrew R. McCallum, Marc Dymetman, Nicola Cancedda",2010-10-25,2010-10-25,2012-04-26,,https://patents.google.com/patent/US20120101804A1/en,https://patentimages.storage.googleapis.com/3d/fd/e2/d4ddef49d5037a/US20120101804A1-20120426-D00000.png
US-2011246409-A1,Data set dimensionality reduction processes and machines ,Indian Statistical Institute,Sushmita Mitra,2010-04-05,2010-05-20,2011-10-06,,https://patents.google.com/patent/US20110246409A1/en,https://patentimages.storage.googleapis.com/10/f7/63/8538880801b6d0/US20110246409A1-20111006-D00000.png
US-7395252-B2,Innervated stochastic controller for real time business decision-making support ,The Trustees Of Columbia University In The City Of New York,"Roger N. Anderson, Albert Boulanger",2003-08-26,2006-02-08,2008-07-01,2008-07-01,https://patents.google.com/patent/US7395252B2/en,https://patentimages.storage.googleapis.com/US7395252B2/US07395252-20080701-D00000.png
US-5841895-A,Method for learning local syntactic relationships for use in example-based information-extraction-pattern learning ,"Pricewaterhousecoopers, Llp",Scott B. Huffman,1996-10-25,1996-10-25,1998-11-24,1998-11-24,https://patents.google.com/patent/US5841895A/en,https://patentimages.storage.googleapis.com/pages/US5841895-10.png
US-2010313141-A1,System and Method for Learning User Genres and Styles and for Matching Products to User Preferences ,"Tianli Yu, Orhan Camoglu, Luca Bertelli, Jacquie Marie Phillips, Muralidharan Venkatasubramanian, Diem Vu, Munjal Shah, Salih Burak Gokturk","Tianli Yu, Orhan Camoglu, Luca Bertelli, Jacquie Marie Phillips, Muralidharan Venkatasubramanian, Diem Vu, Munjal Shah, Salih Burak Gokturk",2009-06-03,2010-06-02,2010-12-09,,https://patents.google.com/patent/US20100313141A1/en,https://patentimages.storage.googleapis.com/ca/fd/73/edbc32f984be5f/US20100313141A1-20101209-D00000.png
CN-1254163-A,Multi-media network reading and learning machine and its use method ,林仁忠,林仁忠,1998-11-18,1998-11-18,2000-05-24,,https://patents.google.com/patent/CN1254163A/en,
CN-101777273-A,Multi-interactive learning and teaching system ,李长云,"何频捷, 李长云, 王志兵",2010-02-08,2010-02-08,2010-07-14,,https://patents.google.com/patent/CN101777273A/en,
US-2014066044-A1,Crowd-sourced contact information and updating system using artificial intelligence ,"Manoj Ramnani, James Timothy Oates","Manoj Ramnani, James Timothy Oates",2012-02-21,2013-11-07,2014-03-06,,https://patents.google.com/patent/US20140066044A1/en,https://patentimages.storage.googleapis.com/59/be/6c/b0d25c83832fc4/US20140066044A1-20140306-D00000.png
US-8185894-B1,Training a virtual machine placement controller ,"Hewlett-Packard Development Company, L.P.","Brian J. Watson, Chris D. Hyser, Bret A. McKee, Robert D. Gardner",2008-01-10,2008-09-24,2012-05-22,2012-05-22,https://patents.google.com/patent/US8185894B1/en,https://patentimages.storage.googleapis.com/3f/7d/7c/9666ddd320e3ed/US08185894-20120522-D00000.png
US-9773196-B2,Utilizing deep learning for automatic digital image segmentation and stylization ,Adobe Systems Incorporated,"Ian Sachs, Xiaoyong Shen, Sylvain Paris, Aaron Hertzmann, Elya Shechtman, Brian Price",2016-01-25,2016-01-25,2017-09-26,2017-09-26,https://patents.google.com/patent/US9773196B2/en,https://patentimages.storage.googleapis.com/b0/2a/04/57106fd8bcbf3d/US09773196-20170926-D00000.png
KR-101657495-B1,Image recognition method using deep learning analysis modular systems ,(주)한국플랫폼서비스기술,"이준혁, 제성관",2015-09-04,2015-09-04,2016-09-30,2016-09-30,https://patents.google.com/patent/KR101657495B1/en,https://patentimages.storage.googleapis.com/8b/eb/69/b84ce3ae4c4b6e/112015086254612-pat00001.png
US-2009327172-A1,Adaptive knowledge-based reasoning in autonomic computing systems ,"Motorola, Inc.","Yan Liu, Michael Zhihe Z. Jiang, John C. Strassner, Jing Zhang",2008-06-27,2008-06-27,2009-12-31,,https://patents.google.com/patent/US20090327172A1/en,
CN-103544392-A,Deep learning based medical gas identifying method ,电子科技大学,"刘启和, 陈雷霆, 蔡洪斌, 邱航, 蒲晓蓉, 胡晓楠",2013-10-23,2013-10-23,2014-01-29,,https://patents.google.com/patent/CN103544392A/en,
US-2007067293-A1,System and methods for automatically identifying answerable questions ,Hong Yu,Hong Yu,2005-06-30,2006-06-30,2007-03-22,,https://patents.google.com/patent/US20070067293A1/en,https://patentimages.storage.googleapis.com/9d/fd/01/82dbd1766957f7/US20070067293A1-20070322-D00000.png
US-2013346347-A1,Method to Predict a Communicative Action that is Most Likely to be Executed Given a Context ,Google Inc.,"Anna Patterson, Hrishikesh Aradhye, Wei Hua, Daniel Lehmann, Ruei-Sung Lin",2012-06-22,2012-08-07,2013-12-26,,https://patents.google.com/patent/US20130346347A1/en,https://patentimages.storage.googleapis.com/27/07/92/63ce497d6faecb/US20130346347A1-20131226-D00000.png
CN-101751437-A,Web active retrieval system based on reinforcement learning ,中国科学院自动化研究所,"刘琰琼, 张文生, 李益群, 杨彦武, 梁玉旋, 肖宪",2008-12-17,2008-12-17,2010-06-23,,https://patents.google.com/patent/CN101751437A/en,
CN-201213039-Y,Network desk type integrated fundamental theory of electrical engineering synchronous learning machine ,鲁润泽;林  瑾;张风琴,鲁润泽,2008-02-22,2008-02-22,2009-03-25,2009-03-25,https://patents.google.com/patent/CN201213039Y/en,
US-9552548-B1,Using classified text and deep learning algorithms to identify risk and provide early warning ,Intraspexion Inc.,Nelson E. Brestoff,2016-07-01,2016-09-27,2017-01-24,2017-01-24,https://patents.google.com/patent/US9552548B1/en,https://patentimages.storage.googleapis.com/75/08/92/093ca0342aaaa1/US09552548-20170124-D00000.png
US-2011191768-A1,Systems and Methods to Identify Users Using an Automated Learning Process ,Xobni Corporation,Adam Michael Smith,2010-02-03,2011-02-03,2011-08-04,,https://patents.google.com/patent/US20110191768A1/en,https://patentimages.storage.googleapis.com/28/05/c9/652a0e3761752e/US20110191768A1-20110804-D00000.png
US-8620842-B1,Systems and methods for classifying electronic information using advanced active learning techniques ,Gordon Villy Cormack,Gordon Villy Cormack,2013-03-15,2013-06-18,2013-12-31,2013-12-31,https://patents.google.com/patent/US8620842B1/en,https://patentimages.storage.googleapis.com/ba/a4/04/491f704998983e/US08620842-20131231-D00000.png
US-2013156297-A1,Learning Image Processing Tasks from Scene Reconstructions ,Microsoft Corporation,"Jamie Daniel Joseph Shotton, Pushmeet Kohli, Stefan Johannes Josef HOLZER, Shahram Izadi, Carsten Curt Eckard Rother, Sebastian Nowozin, David Kim, David Molyneaux, Otmar Hilliges",2011-12-15,2011-12-15,2013-06-20,,https://patents.google.com/patent/US20130156297A1/en,https://patentimages.storage.googleapis.com/d8/4c/52/9a9a9806a0410e/US20130156297A1-20130620-D00000.png
EP-2182458-A1,Acquisition of malicious code using active learning ,Deutsche Telekom AG,Robert Moskovitch,2008-11-03,2009-10-01,2010-05-05,,https://patents.google.com/patent/EP2182458A1/en,https://patentimages.storage.googleapis.com/7c/37/c6/bf5df1b3a9adfa/imgf0001.png
US-8588470-B2,Methods and systems for improved license plate signature matching by similarity learning on synthetic images ,Xerox Corporation,"Jose Antonio RODRIGUEZ SERRANO, Raja Bala, Florent Perronnin, Craig John Saunders, Yonghui Zhao",2011-11-18,2011-11-18,2013-11-19,2013-11-19,https://patents.google.com/patent/US8588470B2/en,https://patentimages.storage.googleapis.com/86/7f/2e/d6de7461925dbd/US08588470-20131119-D00000.png
US-2009274434-A1,Video concept detection using multi-layer multi-instance learning ,Microsoft Corporation,"Tao Mei, Xian-Sheng Hua, Shipeng Li, Zhiwei Gu",2008-04-29,2008-04-29,2009-11-05,,https://patents.google.com/patent/US20090274434A1/en,
US-2013245389-A1,Learning Patient Monitoring and Intervention System ,"Christian P. Schultz, Justinian Rosca, Heiko Claussen, Carolyn Joiner, Steven A. Russell, Nazif Tas","Christian P. Schultz, Justinian Rosca, Heiko Claussen, Carolyn Joiner, Steven A. Russell, Nazif Tas",2012-03-15,2012-12-18,2013-09-19,,https://patents.google.com/patent/US20130245389A1/en,https://patentimages.storage.googleapis.com/67/b3/01/cdb7e7815d1cae/US20130245389A1-20130919-D00000.png
US-2008090736-A1,Using knowledge pattern search and learning for selecting microorganisms ,"Quantum Intelligence, Inc.","Ying Zhao, Charles Zhou, Hsiu-Ying Sherry",2007-07-27,2007-12-03,2008-04-17,,https://patents.google.com/patent/US20080090736A1/en,https://patentimages.storage.googleapis.com/9b/ab/88/33775f305b0227/US20080090736A1-20080417-D00000.png
US-2015032443-A1,Self-learning statistical natural language processing for automatic production of virtual personal assistants ,"Yael Karov, Micha Breakstone, Reshef Shilon, Orgad Keller, Eric Shellef","Yael Karov, Micha Breakstone, Reshef Shilon, Orgad Keller, Eric Shellef",2013-07-25,2014-07-25,2015-01-29,,https://patents.google.com/patent/US20150032443A1/en,https://patentimages.storage.googleapis.com/5e/a5/2e/357f736fb7efd0/US20150032443A1-20150129-D00000.png
US-2009002148-A1,Learning and reasoning about the context-sensitive reliability of sensors ,Microsoft Corporation,Eric J. Horvitz,2007-06-28,2007-06-28,2009-01-01,,https://patents.google.com/patent/US20090002148A1/en,https://patentimages.storage.googleapis.com/US20090002148A1/US20090002148A1-20090101-D00000.png
US-2009074259-A1,Automatic biometric identification based on face recognition and support vector machines ,"Madalina Baltatu, D Alessandro Rosalia, D Amico Roberta, Massimo Tistarelli, Enrico Grosso, Manuele Bicego","Madalina Baltatu, Rosalia D'Alessandro, Roberta D'Amico, Massimo Tistarelli, Enrico Grosso, Manuele Bicego",2005-07-29,2005-07-29,2009-03-19,,https://patents.google.com/patent/US20090074259A1/en,
CN-202996114-U,Two-hand bilingual learning game machine ,张立平,张立平,2012-11-06,2012-11-06,2013-06-12,2013-06-12,https://patents.google.com/patent/CN202996114U/en,
CN-201918042-U,Learning machine controlled by abdominal breathing ,汪银海,汪银海,2010-10-21,2010-10-21,2011-08-03,2011-08-03,https://patents.google.com/patent/CN201918042U/en,
US-2003191726-A1,Machine decisions based on preferential voting techniques ,Kirshenbaum Evan R.,Evan Kirshenbaum,2002-04-05,2002-04-05,2003-10-09,,https://patents.google.com/patent/US20030191726A1/en,https://patentimages.storage.googleapis.com/5f/8b/28/6502665c0e18d7/US20030191726A1-20031009-D00000.png
US-2008233576-A1,Method for feature selection in a support vector machine using feature ranking ,"Jason Weston, Andre Ellisseeff, Bernhard Scholkopf, Fernando Perez-Cruz, Isabelle Guyon","Jason Weston, Andre Ellisseeff, Bernhard Scholkopf, Fernando Perez-Cruz, Isabelle Guyon",1998-05-01,2007-10-30,2008-09-25,,https://patents.google.com/patent/US20080233576A1/en,
US-2011004578-A1,"Active metric learning device, active metric learning method, and program ","Michinari Momma, Satoshi Morinaga, Norikazu Matsumura, Daisuke Komura","Michinari Momma, Satoshi Morinaga, Norikazu Matsumura, Daisuke Komura",2008-02-22,2008-12-08,2011-01-06,,https://patents.google.com/patent/US20110004578A1/en,https://patentimages.storage.googleapis.com/12/53/44/ee8f3db7e55fb7/US20110004578A1-20110106-D00000.png
US-2006230087-A1,System and method for adaptive garbage collection in a virtual machine environment ,"Bea Systems, Inc.",Eva Andreasson,2003-07-30,2006-04-03,2006-10-12,,https://patents.google.com/patent/US20060230087A1/en,https://patentimages.storage.googleapis.com/33/29/4c/5fc0140808219a/US20060230087A1-20061012-D00000.png
US-2010174671-A1,System and method for concurrently conducting cause-and-effect experiments on content effectiveness and adjusting content distribution to optimize business objectives ,"Brooks Brian E, Stankiewicz Brian J, Arthur Jonathan B, Markell Craig G, Linzie Brian L","Brian E. Brooks, Brian J. Stankiewicz, Jonathan B. Arthur, Craig G. Markell, Brian L. Linzie",2009-01-07,2010-01-04,2010-07-08,,https://patents.google.com/patent/US20100174671A1/en,https://patentimages.storage.googleapis.com/0a/6a/9b/0dcda19d62e112/US20100174671A1-20100708-D00000.png
US-7835549-B2,"Learning method of face classification apparatus, face classification method, apparatus and program ",Fujifilm Corporation,"Yoshiro Kitamura, Sadato Akahori, Kensuke Terakawa",2005-03-07,2006-03-07,2010-11-16,2010-11-16,https://patents.google.com/patent/US7835549B2/en,https://patentimages.storage.googleapis.com/03/d1/6c/224295922bcb61/US07835549-20101116-D00000.png
US-2013304691-A1,Inferring user preferences from an internet based social interactive construct ,Ebay Inc.,"Thomas Pinckney, Christopher Dixon, Matthew Ryan GATTIS",2007-11-02,2013-07-18,2013-11-14,,https://patents.google.com/patent/US20130304691A1/en,https://patentimages.storage.googleapis.com/36/13/77/9aae8387b84363/US20130304691A1-20131114-D00000.png
US-2004111314-A1,Satisfaction prediction model for consumers ,Ford Motor Company,Michael Cavaretta,2002-10-16,2002-10-16,2004-06-10,,https://patents.google.com/patent/US20040111314A1/en,https://patentimages.storage.googleapis.com/d6/af/03/3bbe92e97058bd/US20040111314A1-20040610-D00000.png
US-2015128263-A1,Methods and systems for malware detection ,"Cyberpoint International, LLC","Mark V. Raugas, Rebecca A. Borbely, Mike West, James L. Ulrich",2013-11-07,2013-11-07,2015-05-07,,https://patents.google.com/patent/US20150128263A1/en,https://patentimages.storage.googleapis.com/8b/6b/40/8422aa0729caeb/US20150128263A1-20150507-D00000.png
US-2011289025-A1,Learning user intent from rule-based training data ,Microsoft Corporation,"Jun Yan, Ning Liu, Zheng Chen",2010-05-19,2010-05-19,2011-11-24,,https://patents.google.com/patent/US20110289025A1/en,https://patentimages.storage.googleapis.com/3c/b2/e0/17098ece709515/US20110289025A1-20111124-D00000.png
US-2013282627-A1,Learning multiple tasks with boosted decision trees ,Xerox Corporation,"Jean-Baptiste Faddoul, Boris Chidlovskii",2012-04-20,2012-04-20,2013-10-24,,https://patents.google.com/patent/US20130282627A1/en,https://patentimages.storage.googleapis.com/92/d7/11/54e9fed6f630df/US20130282627A1-20131024-D00000.png
US-2003055796-A1,Combinatorial approach for supervised neural network learning ,Honeywell International Inc.,"Ravindra Shetty, Venkatesan Thyagarajan",2001-08-29,2001-08-29,2003-03-20,,https://patents.google.com/patent/US20030055796A1/en,https://patentimages.storage.googleapis.com/79/ad/b6/bfc24ebd68f7c0/US20030055796A1-20030320-D00000.png
US-2016034814-A1,Noise-boosted back propagation and deep learning neural networks ,University Of Southern California,"Kartik Audhkhasi, Osonde Osoba, Bart Kosko",2014-08-01,2015-08-03,2016-02-04,,https://patents.google.com/patent/US20160034814A1/en,https://patentimages.storage.googleapis.com/35/42/bb/04f0b180473e3a/US20160034814A1-20160204-D00000.png
US-2006195409-A1,"Learning control apparatus, learning control method, and computer program ",Sony Corporation,"Kohtaro Sabe, Kenichi Hidai",2005-02-23,2006-02-09,2006-08-31,,https://patents.google.com/patent/US20060195409A1/en,https://patentimages.storage.googleapis.com/9c/36/49/51294c2e349de2/US20060195409A1-20060831-D00000.png
CN-104866727-A,Deep learning-based method for analyzing medical data and intelligent analyzer thereof ,陈宽,陈宽,2015-06-02,2015-06-02,2015-08-26,,https://patents.google.com/patent/CN104866727A/en,
US-2014344453-A1,Automated learning of peering policies for popularity driven replication in content delivery framework ,"Level 3 Communications, Llc","Lewis Robert Varney, Laurence R. Lipstone, William Crowder, Andrew Swart, Christopher Newton",2012-12-13,2014-06-17,2014-11-20,,https://patents.google.com/patent/US20140344453A1/en,https://patentimages.storage.googleapis.com/fb/45/d2/9120bba8cc38fb/US20140344453A1-20141120-D00000.png
US-6505185-B1,Dynamic determination of continuous split intervals for decision-tree learning without sorting ,Microsoft Corporation,D. Maxwell Chickering,2000-03-30,2000-03-30,2003-01-07,2003-01-07,https://patents.google.com/patent/US6505185B1/en,https://patentimages.storage.googleapis.com/4b/fb/7b/e31d8af2504476/US06505185-20030107-D00000.png
US-2006074908-A1,Method and apparatus for efficient training of support vector machines ,"Selvaraj Sathiya K, Decoste Dennis M","Sathiya Selvaraj, Dennis DeCoste",2004-09-24,2004-09-24,2006-04-06,,https://patents.google.com/patent/US20060074908A1/en,https://patentimages.storage.googleapis.com/f7/77/6e/8e9273bb72d942/US20060074908A1-20060406-D00000.png
US-6741974-B1,Genetically programmed learning classifier system for complex adaptive system processing with agent-based architecture ,Lockheed Martin Corporation,"Gregory A. Harrison, Keith Hollister, Eric Worden",2000-06-02,2000-06-02,2004-05-25,2004-05-25,https://patents.google.com/patent/US6741974B1/en,https://patentimages.storage.googleapis.com/38/6f/4f/f513b6b4f00aa3/US06741974-20040525-D00000.png
US-2007027674-A1,Analytical system for discovery and generation of rules to predict and detect anomalies in data and financial fraud ,Future Route Limited,"Rupert Parson, John Andersson, Timothy Ball, Wael Khatib, Patrick Tschorn, Stephen Muggleton",2005-06-20,2006-06-15,2007-02-01,,https://patents.google.com/patent/US20070027674A1/en,https://patentimages.storage.googleapis.com/58/0d/81/afe06fd3b364ab/US20070027674A1-20070201-D00000.png
US-2015172321-A1,Systems and Methods for Cloud Security Monitoring and Threat Intelligence ,"Palerra, Inc.","Ganesh Kirti, Rohit Gupta, Kamalendu Biswas, Ramana Rao Satyasai Turlapati",2013-12-13,2014-10-24,2015-06-18,,https://patents.google.com/patent/US20150172321A1/en,https://patentimages.storage.googleapis.com/8c/4a/ee/36f750469abbd4/US20150172321A1-20150618-D00000.png
US-2006074834-A1,Methods and systems for 3D object detection using learning ,"Anlei Dong, Zhou Xiang S, Dorin Comaniciu, Schultz Christian P","Anlei Dong, Xiang Zhou, Dorin Comaniciu, Christian Schultz",2004-09-07,2005-08-30,2006-04-06,,https://patents.google.com/patent/US20060074834A1/en,https://patentimages.storage.googleapis.com/8a/3e/b4/dd75d0f1eb7a5d/US20060074834A1-20060406-D00000.png
US-2014073977-A1,Systems and methods for estimating blood flow characteristics from vessel geometry and physiology ,"Heartflow, Inc.","Leo Grady, Gilwoo Choi, Michael Singer",2012-09-12,2013-05-16,2014-03-13,,https://patents.google.com/patent/US20140073977A1/en,https://patentimages.storage.googleapis.com/ab/34/9f/3caee308f031bf/US20140073977A1-20140313-D00000.png
