CN-105224986-B,Neural networks based on the depth of the memristive device ,清华大学,"李国齐, 邓磊, 施路平, 裴京",2015-09-29,2015-09-29,2018-01-23,2018-01-23,https://patents.google.com/patent/CN105224986B/en,
US-2018260699-A1,Technologies for deep machine learning with convolutional neural networks and reduced set support vector machines ,Intel IP Corporation,"Koba Natroshvili, Kay-Ulrich Scholl",2017-03-13,2017-03-13,2018-09-13,,https://patents.google.com/patent/US20180260699A1/en,https://patentimages.storage.googleapis.com/0b/e9/94/0e17ee454d9a9a/US20180260699A1-20180913-D00000.png
CN-104751228-B,Construction Method and system for depth neural networks for speech recognition ,科大讯飞股份有限公司,"潘嘉, 何婷婷, 刘聪, 王智国, 胡国平, 张仕良, 胡郁",2013-12-31,2013-12-31,2018-04-27,2018-04-27,https://patents.google.com/patent/CN104751228B/en,
US-2017357890-A1,Computing System for Inferring Demographics Using Deep Learning Computations and Social Proximity on a Social Data Network ,Sysomos L.P.,"Edward Dong-Jin KIM, Ousmane Amadou DIA, Kanchana PADMANABHAN, Koushik PAL",2016-06-09,2017-06-02,2017-12-14,,https://patents.google.com/patent/US20170357890A1/en,https://patentimages.storage.googleapis.com/39/fb/ef/788824ee56446f/US20170357890A1-20171214-D00000.png
US-2018137417-A1,Parsimonious inference on convolutional neural networks ,Irida Labs S.A.,"Ilias Theodorakopoulos, Vassileios POTHOS, Dimitris Kastaniotis, Nikos Fragoulis",2016-11-17,2017-11-16,2018-05-17,,https://patents.google.com/patent/US20180137417A1/en,https://patentimages.storage.googleapis.com/12/5e/e6/c9c0a4df83b7ba/US20180137417A1-20180517-D00000.png
CN-104850845-B,A traffic sign recognition method asymmetric convolutional neural network ,大连理工大学,"葛宏伟, 何鹏程, 孙亮, 谭贞刚",2015-05-30,2015-05-30,2017-12-26,2017-12-26,https://patents.google.com/patent/CN104850845B/en,
US-2018068655-A1,Adjusting a deep neural network acoustic model ,International Business Machines Corporation,"Xiaodong Cui, Vaibhava Goel",2016-09-07,2016-09-07,2018-03-08,,https://patents.google.com/patent/US20180068655A1/en,https://patentimages.storage.googleapis.com/f8/82/df/23231f843190d8/US20180068655A1-20180308-D00000.png
US-2018225823-A1,Adversarial and Dual Inverse Deep Learning Networks for Medical Image Analysis ,Siemens Healthcare Gmbh,"Shaohua Kevin Zhou, Mingqing Chen, Daguang Xu, Zhoubing XU, Dong Yang",2017-02-09,2018-01-11,2018-08-09,,https://patents.google.com/patent/US20180225823A1/en,https://patentimages.storage.googleapis.com/5e/ba/b8/129d357aa920d2/US20180225823A1-20180809-D00000.png
US-2018137406-A1,Efficient Convolutional Neural Networks and Techniques to Reduce Associated Computational Costs ,Google Inc.,"Andrew Gerald Howard, Bo Chen, Dmitry Kalenichenko, Tobias Christoph Weyand, Menglong Zhu, Marco Andreetto, Weijun Wang",2016-11-15,2017-09-18,2018-05-17,,https://patents.google.com/patent/US20180137406A1/en,https://patentimages.storage.googleapis.com/81/19/0d/0a82ff5d3cf0e9/US20180137406A1-20180517-D00000.png
US-2018108139-A1,System And Method For N-Dimensional Image Segmentation Using Convolutional Neural Networks ,U.S. Department Of Veterans Affairs,"Michael Abramoff, Xiaodong Wu",2016-10-19,2017-10-19,2018-04-19,,https://patents.google.com/patent/US20180108139A1/en,https://patentimages.storage.googleapis.com/0c/93/c7/0b44b9e019e628/US20180108139A1-20180419-D00000.png
US-2017330264-A1,"Methods, apparatuses and systems for computer vision and deep learning ","YOURO, Inc.","Mohamed Youssef, Amro S. AMER",2016-05-10,2017-05-05,2017-11-16,,https://patents.google.com/patent/US20170330264A1/en,https://patentimages.storage.googleapis.com/99/a6/d7/294abb62a62699/US20170330264A1-20171116-D00000.png
US-2018158189-A1,System and method for a deep learning machine for object detection ,"Samsung Electronics Co., Ltd.","Arvind YEDLA, Marcel Nassar, Mostafa El-Khamy, Jungwon Lee",2016-12-07,2017-04-04,2018-06-07,,https://patents.google.com/patent/US20180158189A1/en,https://patentimages.storage.googleapis.com/a7/f7/61/d0c4c7e5a2a656/US20180158189A1-20180607-D00000.png
US-2018268256-A1,Systems and methods for keypoint detection with convolutional neural networks ,"Aquifi, Inc.","Paolo Di Febbo, Carlo Dal Mutto, Kinh Tieu",2017-03-16,2018-03-16,2018-09-20,,https://patents.google.com/patent/US20180268256A1/en,https://patentimages.storage.googleapis.com/9c/52/a2/d789d7ac119f92/US20180268256A1-20180920-D00000.png
CN-104866868-B,Metal coins based on depth identification method and apparatus Neural Network ,杭州朗和科技有限公司,"陈海波, 吴伟, 李晓燕, 陈刚",2015-05-22,2015-05-22,2018-09-07,2018-09-07,https://patents.google.com/patent/CN104866868B/en,
US-2018253817-A1,Deep learning via dynamic root solvers ,International Business Machines Corporation,Anto Ajay Raj John,2017-03-03,2017-12-29,2018-09-06,,https://patents.google.com/patent/US20180253817A1/en,https://patentimages.storage.googleapis.com/7d/b3/a6/78a33ef63f8c9f/US20180253817A1-20180906-D00000.png
EP-3093821-A1,Method and system for anatomical object pose detection using marginal space deep neural networks ,Siemens Aktiengesellschaft,"Dorin Comaniciu, Bogdan Georgescu, David Liu, Hien Nguyen, Vivek Kumar Singh, Yefeng Zheng",2015-04-16,2016-04-15,2016-11-16,,https://patents.google.com/patent/EP3093821A1/en,https://patentimages.storage.googleapis.com/4c/33/1f/83c687df4aef35/imgf0001.png
CN-205621018-U,Cell -phone cell convolutional neural network accelerator ,陈进民,陈进民,2016-02-26,2016-02-26,2016-10-05,2016-10-05,https://patents.google.com/patent/CN205621018U/en,
US-2018150684-A1,Age and gender estimation using small-scale convolutional neural network (cnn) modules for embedded systems ,"Shenzhen AltumView Technology Co., Ltd.","Xing Wang, Mehdi Seyfi, Minghua Chen, Him Wai Ng, Jie Liang",2016-11-30,2017-10-03,2018-05-31,,https://patents.google.com/patent/US20180150684A1/en,https://patentimages.storage.googleapis.com/60/41/0d/368a585ec8210a/US20180150684A1-20180531-D00000.png
US-2018181881-A1,System and method for training deep learning classification networks ,"Samsung Electronics Co., Ltd.","Xianzhi Du, Mostafa El-Khamy, Jungwon Lee",2016-12-22,2017-05-05,2018-06-28,,https://patents.google.com/patent/US20180181881A1/en,https://patentimages.storage.googleapis.com/5a/52/42/760f33ef99d9b8/US20180181881A1-20180628-D00000.png
CN-105279288-B,Kinds of online content recommendation method based on neural network depth ,深圳大学,"陈亮, 王娜, 李霞",2015-12-04,2015-12-04,2018-08-24,2018-08-24,https://patents.google.com/patent/CN105279288B/en,
CN-205665729-U,Cell convolutional neural network intelligent vision pays accelerator ,"陈进民, 林建国","陈进民, 林建国",2016-03-09,2016-03-09,2016-10-26,2016-10-26,https://patents.google.com/patent/CN205665729U/en,
US-2018261213-A1,Convolutional recurrent neural networks for small-footprint keyword spotting ,Baidu Usa Llc,"Sercan Arik, Markus KLIEGL, Rewon CHILD, Joel Hestness, Andrew GIBIANSKY, Christopher Fougner, Ryan Prenger, Adam Coates",2017-03-13,2017-08-28,2018-09-13,,https://patents.google.com/patent/US20180261213A1/en,https://patentimages.storage.googleapis.com/d3/a6/87/93b8ef42a863ad/US20180261213A1-20180913-D00000.png
US-2017068888-A1,Cost-sensitive classification with deep learning using cost-aware pre-training ,Intel Corporation,"Yu-An Chung, Guang-He Lee, Shao-Wen Yang",2015-09-09,2015-12-24,2017-03-09,,https://patents.google.com/patent/US20170068888A1/en,https://patentimages.storage.googleapis.com/5f/b0/f5/f89e20104c452b/US20170068888A1-20170309-D00000.png
WO-2018000281-A1,User portrait representation learning system and method based on deep neural network ,深圳狗尾草智能科技有限公司,"邱楠, 杨新宇, 王昊奋",2016-06-29,2016-06-29,2018-01-04,,https://patents.google.com/patent/WO2018000281A1/en,https://patentimages.storage.googleapis.com/99/71/bc/2242dc738504b4/PCTCN2016087773-appb-300001.png
US-2018137349-A1,System and method of character recognition using fully convolutional neural networks ,Kodak Alaris Inc.,"Felipe Petroski SUCH, Raymond Ptucha, Frank BROCKLER, Paul HUTKOWSKI, Vatsala Singh",2016-11-14,2017-09-19,2018-05-17,,https://patents.google.com/patent/US20180137349A1/en,https://patentimages.storage.googleapis.com/f6/83/23/6245676dc1979a/US20180137349A1-20180517-D00000.png
US-2018101766-A1,Efficient calculations of negative curvature in a hessian free deep learning framework ,Siemens Aktiengesellschaft,"Xi He, Ioannis Akrotirianakis, Amit Chakraborty",2016-10-11,2016-10-11,2018-04-12,,https://patents.google.com/patent/US20180101766A1/en,https://patentimages.storage.googleapis.com/e6/84/f8/d3467e6c83ff27/US20180101766A1-20180412-D00000.png
US-2018260665-A1,Deep learning system for recognizing pills in images ,Board Of Trustees Of Michigan State University,"Mi Zhang, Kai Cao, Xiao Zeng",2017-03-07,2018-03-06,2018-09-13,,https://patents.google.com/patent/US20180260665A1/en,https://patentimages.storage.googleapis.com/5a/23/88/551eb092a59a57/US20180260665A1-20180913-D00000.png
US-2018121791-A1,Temporal difference estimation in an artificial neural network ,Qualcomm Incorporated,"Peter O'Connor, Max Welling",2016-11-03,2017-05-09,2018-05-03,,https://patents.google.com/patent/US20180121791A1/en,https://patentimages.storage.googleapis.com/7c/b6/94/da8ec8216b9436/US20180121791A1-20180503-D00000.png
US-2018096249-A1,Convolutional neural network system using adaptive pruning and weight sharing and operation method thereof ,Electronics And Telecommunications Research Institute,"Jin Kyu Kim, Joo Hyun Lee",2016-10-04,2017-09-28,2018-04-05,,https://patents.google.com/patent/US20180096249A1/en,https://patentimages.storage.googleapis.com/76/2b/61/3b1897a5d267ed/US20180096249A1-20180405-D00000.png
NL-2016285-B1,Device and method for generating a group equivariant convolutional neural network. ,Scyfer B V,"Sebastiaan Cohen Taco, Welling Max",2016-02-19,2016-02-19,2017-09-20,2017-09-20,https://patents.google.com/patent/NL2016285B1/en,
EP-3291146-A1,Knowledge extraction from a convolutional neural network ,Fujitsu Limited,Joseph Townsend,2016-09-05,2017-04-10,2018-03-07,,https://patents.google.com/patent/EP3291146A1/en,https://patentimages.storage.googleapis.com/55/8b/18/69c89ecabc306f/imgf0001.png
US-2017032245-A1,Systems and Methods for Providing Reinforcement Learning in a Deep Learning System ,The Board Of Trustees Of The Leland Stanford Junior University,"Ian David Moffat Osband, Benjamin Van Roy",2015-07-01,2016-07-15,2017-02-02,,https://patents.google.com/patent/US20170032245A1/en,https://patentimages.storage.googleapis.com/65/52/83/6859db21b75e1f/US20170032245A1-20170202-D00000.png
CN-205680247-U,Cell convolutional neural network intelligent vision driving fatigue monitors accelerator ,陈进民,"陈进民, 虞惠华",2016-04-19,2016-04-19,2016-11-09,2016-11-09,https://patents.google.com/patent/CN205680247U/en,
US-2017169327-A1,Convolutional neural network ,"Analog Devices, Inc.","Eric G. Nestler, Mitra M. OSQUI, Jeffrey G. Bernstein",2015-12-15,2016-12-14,2017-06-15,,https://patents.google.com/patent/US20170169327A1/en,https://patentimages.storage.googleapis.com/12/b2/44/d2439eca354b31/US20170169327A1-20170615-D00000.png
WO-2017206066-A1,Method and apparatus for detecting small objects with an enhanced deep neural network ,Nokia Technologies Oy,Jiale CAO,2016-05-31,2016-05-31,2017-12-07,,https://patents.google.com/patent/WO2017206066A1/en,https://patentimages.storage.googleapis.com/22/1f/21/06ecf2e270a1cb/PCTCN2016084128-appb-300001.png
US-2018137350-A1,System and method of character recognition using fully convolutional neural networks with attention ,Kodak Alaris Inc.,"Felipe Petroski SUCH, Raymond Ptucha, Frank BROCKLER, Paul HUTKOWSKI",2016-11-14,2017-11-14,2018-05-17,,https://patents.google.com/patent/US20180137350A1/en,https://patentimages.storage.googleapis.com/60/49/89/281c32a08f4a69/US20180137350A1-20180517-D00000.png
US-2018247549-A1,Deep academic learning intelligence and deep neural language network system and interfaces ,Scriyb LLC,"Scott Mckay MARTIN, James R. Casey, Christopher Etesse",2017-02-21,2018-02-21,2018-08-30,,https://patents.google.com/patent/US20180247549A1/en,https://patentimages.storage.googleapis.com/59/9f/51/b63f7f7e33d2c8/US20180247549A1-20180830-D00000.png
US-2018114109-A1,Deep convolutional neural networks with squashed filters ,Nokia Technologies Oy,Yazhao LI,2016-10-20,2016-10-20,2018-04-26,,https://patents.google.com/patent/US20180114109A1/en,https://patentimages.storage.googleapis.com/bf/45/05/bfd18c1637542c/US20180114109A1-20180426-D00000.png
US-2018107928-A1,Diagnostic systems and methods for deep learning models configured for semiconductor applications ,Kla-Tencor Corporation,"Jing Zhang, Ravi Chandra Donapati, Mark Roulo, Kris Bhaskar",2016-10-14,2017-09-01,2018-04-19,,https://patents.google.com/patent/US20180107928A1/en,https://patentimages.storage.googleapis.com/ee/d8/48/ac761781c67d02/US20180107928A1-20180419-D00000.png
WO-2017157112-A1,Method and system for bit-depth reduction in artificial neural networks ,Hong Kong Applied Science and Technology Research Institute Company Limited,"Chao Shi, Luhong Liang, Kwok Wai Hung, King Hung Chiu",2016-03-16,2017-02-07,2017-09-21,,https://patents.google.com/patent/WO2017157112A1/en,https://patentimages.storage.googleapis.com/0f/ae/a9/4dd5290db8fc8f/PCTCN2017073070-appb-300001.png
CN-107871124-B,Remote Sensing Target Species Based on Neural Network depth ,陕西师范大学,"汪西莉, 周明非",2017-11-15,2017-11-15,2018-08-10,2018-08-10,https://patents.google.com/patent/CN107871124B/en,
US-2017140270-A1,Asynchronous deep reinforcement learning ,Google Inc.,"Volodymyr Mnih, Adrià Puigdomènech Badia, Alexander Benjamin Graves, Timothy James Alexander Harley, David Silver, Koray Kavukcuoglu",2015-11-12,2016-11-11,2017-05-18,,https://patents.google.com/patent/US20170140270A1/en,https://patentimages.storage.googleapis.com/6c/8d/84/f1969417ecb927/US20170140270A1-20170518-D00000.png
US-2018053056-A1,Augmented reality display device with deep learning sensors ,"Magic Leap, Inc.","Andrew Rabinovich, Tomasz Jan Malisiewicz, Daniel DeTone",2016-08-22,2017-08-22,2018-02-22,,https://patents.google.com/patent/US20180053056A1/en,https://patentimages.storage.googleapis.com/4c/b1/be/68ed12c8e2fa30/US20180053056A1-20180222-D00000.png
US-2016098646-A1,Dynamically modifying a boundary of a deep learning network ,Seagate Technology Llc,"Kevin Arthur Gomez, Frank Dropps, Ryan James Goss, Jon Trantham, Antoine Khoueir",2014-10-06,2014-10-06,2016-04-07,,https://patents.google.com/patent/US20160098646A1/en,https://patentimages.storage.googleapis.com/44/ba/80/ce5fa4aeab97fb/US20160098646A1-20160407-D00000.png
CN-205665733-U,Because cell neural network or convolution neural network's user identification system in advertising media input terminal ,陈进民,"李江, 陈进民",2016-04-05,2016-04-05,2016-10-26,2016-10-26,https://patents.google.com/patent/CN205665733U/en,
WO-2016145850-A1,Construction method for deep long short-term memory recurrent neural network acoustic model based on selective attention principle ,清华大学,"杨毅, 孙甲松",2015-03-19,2015-10-21,2016-09-22,,https://patents.google.com/patent/WO2016145850A1/en,https://patentimages.storage.googleapis.com/5d/30/f3/456a609bcbd6fb/PCTCN2015092381-appb-300001.png
US-2018137400-A1,Enhanced Communication Assistance with Deep Learning ,Google Inc.,"Thomas Deselaers, Victor Carbune, Pedro Gonnet Anders, Daniel Martin Keysers",2016-11-11,2016-11-11,2018-05-17,,https://patents.google.com/patent/US20180137400A1/en,https://patentimages.storage.googleapis.com/d9/07/fb/85e824156e1eb6/US20180137400A1-20180517-D00000.png
US-2017243085-A1,Image classification neural networks ,Google Inc.,"Vincent O. Vanhoucke, Christian Szegedy, Sergey Ioffe",2016-02-18,2016-12-30,2017-08-24,,https://patents.google.com/patent/US20170243085A1/en,https://patentimages.storage.googleapis.com/fa/fc/20/c89effff49c4f9/US20170243085A1-20170824-D00000.png
US-2018046900-A1,Sparse convolutional neural network accelerator ,Nvidia Corporation,"William J. Dally, Angshuman Parashar, Joel Springer Emer, Stephen William Keckler, Larry Robert Dennison",2016-08-11,2017-07-25,2018-02-15,,https://patents.google.com/patent/US20180046900A1/en,https://patentimages.storage.googleapis.com/4f/5c/9e/4a80b7b9042545/US20180046900A1-20180215-D00000.png
CN-104934028-B,Method and apparatus for depth of training the neural network model for speech synthesis ,百度在线网络技术（北京）有限公司,"盖于涛, 康永国",2015-06-17,2015-06-17,2017-11-17,2017-11-17,https://patents.google.com/patent/CN104934028B/en,
US-2018136912-A1,Systems and methods for automatically generating code for deep learning systems ,"The Mathworks, Inc.","Girish Venkataramani, Rama P. Kokku, Jayaprabha Shankar, James L. Brock, Chun-Yu Shei, Vijaya Raghavan, Yaohung Tsai",2016-11-17,2017-11-17,2018-05-17,,https://patents.google.com/patent/US20180136912A1/en,https://patentimages.storage.googleapis.com/9f/68/e1/edcd481117f295/US20180136912A1-20180517-D00000.png
WO-2018058509-A1,Dynamic neural network surgery ,Intel Corporation,"Anbang YAO, Yiwen Guo, Yan Li, Yurong Chen",2016-09-30,2016-09-30,2018-04-05,,https://patents.google.com/patent/WO2018058509A1/en,https://patentimages.storage.googleapis.com/fc/a3/36/0d8176610c5a18/PCTCN2016101043-appb-300001.png
US-2018068429-A1,Image Steganalysis Based on Deep Learning ,Institute Of Automation Chinese Academy Of Sciences,"Tieniu Tan, Dong Jing, Wei Wang, Yinlong Qian",2015-04-15,2015-04-15,2018-03-08,,https://patents.google.com/patent/US20180068429A1/en,https://patentimages.storage.googleapis.com/3d/8a/50/291fa982d1f855/US20180068429A1-20180308-D00000.png
US-2017323202-A1,"Recognition apparatus based on deep neural network, training apparatus and methods thereof ",Fujitsu Limited,"Song Wang, Wei Fan, Jun Sun",2016-05-06,2017-05-05,2017-11-09,,https://patents.google.com/patent/US20170323202A1/en,https://patentimages.storage.googleapis.com/ab/8d/2c/268ec070f57d52/US20170323202A1-20171109-D00000.png
US-2018260703-A1,Systems and methods for training neural networks ,Massachusetts Institute Of Technology,"Marin Soljacic, Yichen Shen, Li Jing, Tena Dubcek, Scott SKIRLO, John E. Peurifoy, Max Erik Tegmark",2016-11-22,2017-11-22,2018-09-13,,https://patents.google.com/patent/US20180260703A1/en,https://patentimages.storage.googleapis.com/20/a0/a7/975eed5f66861c/US20180260703A1-20180913-D00000.png
CN-105184367-B,Method and system parameters depth training model neural network ,讯飞智元信息科技有限公司,"潘嘉, 刘聪, 何婷婷, 乔玉平, 王智国, 胡郁, 刘庆峰",2014-06-09,2014-06-09,2018-08-14,2018-08-14,https://patents.google.com/patent/CN105184367B/en,
WO-2017215240-A1,"Neural network-based method and device for face feature extraction and modeling, and face recognition ",广州视源电子科技股份有限公司,张玉兵,2016-06-14,2016-12-29,2017-12-21,,https://patents.google.com/patent/WO2017215240A1/en,https://patentimages.storage.googleapis.com/11/ca/58/22a012ea40c368/PCTCN2016113123-appb-300001.png
US-2018197317-A1,Deep learning based acceleration for iterative tomographic reconstruction ,General Electric Company,"Lishui Cheng, Bruno Kristiaan Bernard De Man, Sheshadri Thiruvenkadam, Sangtae Ahn, Lin Fu, Hao Lai",2017-01-06,2017-01-06,2018-07-12,,https://patents.google.com/patent/US20180197317A1/en,https://patentimages.storage.googleapis.com/76/e1/cd/48671cff6f0371/US20180197317A1-20180712-D00000.png
US-2018218254-A1,Solar power forecasting with volumetric convolutional neural network ,International Business Machines Corporation,"Minwei Feng, Tarun Kumar, Rui Zhang, Wei Zhang",2017-02-02,2017-02-02,2018-08-02,,https://patents.google.com/patent/US20180218254A1/en,https://patentimages.storage.googleapis.com/2e/17/20/0bfdb309bd63dc/US20180218254A1-20180802-D00000.png
US-2018211155-A1,Method for synthesizing a neural network ,Fotonation Limited,"Shabab BAZRAFKAN, Joe LEMLEY",2017-01-23,2017-01-23,2018-07-26,,https://patents.google.com/patent/US20180211155A1/en,https://patentimages.storage.googleapis.com/aa/d1/3c/cbd3b66abc46b1/US20180211155A1-20180726-D00000.png
US-2016307095-A1,Small-footprint deep neural network ,"Microsoft Technology Licensing, Llc","Jinyu Li, Yifan Gong, Yongqiang Wang",2015-04-17,2016-01-19,2016-10-20,,https://patents.google.com/patent/US20160307095A1/en,https://patentimages.storage.googleapis.com/3e/a8/c8/1b3b61946d84cc/US20160307095A1-20161020-D00000.png
WO-2018120013-A1,Artificial neural network ,"Nokia Technologies Oy, Nokia Technologies (Beijing) Co., Ltd.",Xiaoheng JIANG,2016-12-30,2016-12-30,2018-07-05,,https://patents.google.com/patent/WO2018120013A1/en,https://patentimages.storage.googleapis.com/27/69/49/826bf1e8d147ae/PCTCN2016113477-appb-300001.png
WO-2017198169-A1,Reduction of parameters in fully connected layers of neural networks ,"Huawei Technologies Co., Ltd.","Barnaby Dalton, Serdar SOZUBEK, Manuel Saldana, Vanessa Courville",2016-05-17,2017-05-17,2017-11-23,,https://patents.google.com/patent/WO2017198169A1/en,https://patentimages.storage.googleapis.com/6b/91/7e/dd506500f4ae47/PCTCN2017084666-appb-300001.png
CN-205665697-U,Medical science video identification diagnostic system based on cell neural network or convolution neural network ,陈进民,"陈芳丹, 陈进民",2016-04-05,2016-04-05,2016-10-26,2016-10-26,https://patents.google.com/patent/CN205665697U/en,
US-2018218275-A1,"Method of operating neural networks, corresponding network, apparatus and computer program product ",Stmicroelectronics S.R.L.,"Valentina ARRIGONI, Giuseppe Desoli, Beatrice ROSSI, Pasqualina Fragneto",2017-01-27,2018-01-22,2018-08-02,,https://patents.google.com/patent/US20180218275A1/en,https://patentimages.storage.googleapis.com/0e/3f/86/3f76543fe72296/US20180218275A1-20180802-D00000.png
US-2018129930-A1,"Learning method based on deep learning model having non-consecutive stochastic neuron and knowledge transfer, and system thereof ",Korea Advanced Institute Of Science And Technology,"Jinwoo Shin, Song Chong, Kimin Lee",2016-11-07,2016-11-30,2018-05-10,,https://patents.google.com/patent/US20180129930A1/en,https://patentimages.storage.googleapis.com/07/40/71/dd538d16fb6974/US20180129930A1-20180510-D00000.png
US-2018165578-A1,Deep neural network compression apparatus and method ,Electronics And Telecommunications Research Institute,"Hoon Chung, Jeon Gue Park, Sung Joo Lee, Yun Keun Lee",2016-12-08,2017-04-04,2018-06-14,,https://patents.google.com/patent/US20180165578A1/en,https://patentimages.storage.googleapis.com/94/7a/4a/ea41b5bd52c8d2/US20180165578A1-20180614-D00000.png
US-2017337465-A1,Reduction of parameters in fully connected layers of neural networks by low rank factorizations ,"Serdar SOZUBEK, Barnaby Dalton, Vanessa COURVILLE, Graham Taylor","Serdar SOZUBEK, Barnaby Dalton, Vanessa COURVILLE, Graham Taylor",2016-05-17,2017-03-08,2017-11-23,,https://patents.google.com/patent/US20170337465A1/en,https://patentimages.storage.googleapis.com/c9/8d/aa/e4149c90d81bdc/US20170337465A1-20171123-D00000.png
CN-105654176-B,Training apparatus and method for neural networks and neural network system ,富士通株式会社,"王淞, 范伟, 孙俊",2014-11-14,2014-11-14,2018-03-27,2018-03-27,https://patents.google.com/patent/CN105654176B/en,
US-2016260428-A1,"Statistical acoustic model adaptation method, acoustic model learning method suitable for statistical acoustic model adaptation, storage medium storing parameters for building deep neural network, and computer program for adapting statistical acoustic model ",National Institute Of Information And Communications Technology,"Shigeki Matsuda, Xugang LU",2013-11-27,2014-11-06,2016-09-08,,https://patents.google.com/patent/US20160260428A1/en,https://patentimages.storage.googleapis.com/a5/cb/ab/a886306c997ed3/US20160260428A1-20160908-D00000.png
CN-105105743-A,Intelligent electrocardiogram diagnosis method based on deep neural network ,山东省计算中心（国家超级计算济南中心）,"舒明雷, 高岩, 王英龙, 杨明, 王春梅, 孔祥龙, 王海燕, 许继勇, 陈长芳, 单珂",2015-08-21,2015-08-21,2015-12-02,,https://patents.google.com/patent/CN105105743A/en,
CN-104680491-A,Non-uniform image motion blur removing method based on deep neural network ,西安交通大学,"孙剑, 曹文飞, 徐宗本",2015-02-28,2015-02-28,2015-06-03,,https://patents.google.com/patent/CN104680491A/en,
CN-105404632-A,Deep neural network based biomedical text serialization labeling system and method ,深港产学研基地,"姚霖, 刘轶, 刘宏",2014-09-15,2014-09-15,2016-03-16,,https://patents.google.com/patent/CN105404632A/en,
US-2017127016-A1,Systems and methods for video paragraph captioning using hierarchical recurrent neural networks ,Baidu Usa Llc,"Haonan Yu, Jiang Wang, Zhiheng HUANG, Yi Yang, Wei Xu",2015-10-29,2016-06-15,2017-05-04,,https://patents.google.com/patent/US20170127016A1/en,https://patentimages.storage.googleapis.com/d9/51/56/18e7b11ed39ca0/US20170127016A1-20170504-D00000.png
CN-106250812-A,Vehicle type recognition method based on rapid R-CNN deep neural network ,"姹ゅ钩, 汤一平","姹ゅ钩, 汤一平",2016-07-15,2016-07-15,2016-12-21,,https://patents.google.com/patent/CN106250812A/en,
CN-105930686-A,Secondary protein structureprediction method based on deep neural network ,四川大学,"毛华, 陈媛媛, 罗川, 汪洋旭, 陈盈科",2016-07-05,2016-07-05,2016-09-07,,https://patents.google.com/patent/CN105930686A/en,
US-2015170020-A1,Reducing dynamic range of low-rank decomposition matrices ,"Amazon Technologies, Inc.",Sri Venkata Surya Siva Rama Krishna Garimella,2013-12-13,2013-12-13,2015-06-18,,https://patents.google.com/patent/US20150170020A1/en,https://patentimages.storage.googleapis.com/87/5b/7b/9a8972b86c56c3/US20150170020A1-20150618-D00000.png
