US-2017032285-A1,Authenticating physical objects using machine learning from microscopic variations ,Entrupy Inc.,"Ashlesh Sharma, Lakshminarayanan Subramanian, Yiduth Srinivasan",2014-04-09,2015-04-09,2017-02-02,,https://patents.google.com/patent/US20170032285A1/en,https://patentimages.storage.googleapis.com/b8/23/e2/ddf17e5efa1b7b/US20170032285A1-20170202-D00000.png
US-2014304197-A1,Incremental machine learning for data loss prevention ,"Sumesh Jaiswal, Ashish Aggarwal, Phillip DiCorpo, Shitalkumar S. Sawant, Sally Kauffman, Alan Dale Galindez","Sumesh Jaiswal, Ashish Aggarwal, Phillip DiCorpo, Shitalkumar S. Sawant, Sally Kauffman, Alan Dale Galindez",2010-12-14,2011-12-14,2014-10-09,,https://patents.google.com/patent/US20140304197A1/en,https://patentimages.storage.googleapis.com/d0/0b/23/df9585dc7864cb/US20140304197A1-20141009-D00000.png
US-2016028599-A1,Scheduling predictive models for machine learning systems ,"Cisco Technology, Inc.","Jean-Philippe Vasseur, Sukrit Dasgupta, Grégory Mermoud",2014-07-23,2015-01-07,2016-01-28,,https://patents.google.com/patent/US20160028599A1/en,https://patentimages.storage.googleapis.com/b7/2f/b7/fe58148f4c7a94/US20160028599A1-20160128-D00000.png
US-2016034786-A1,Computerized machine learning of interesting video sections ,Microsoft Corporation,"Nitin Suri, Xian-Sheng Hua, Tzong-Jhy Wang, William D. Sproule, Andrew S. Ivory, Jin Li",2014-07-29,2014-07-29,2016-02-04,,https://patents.google.com/patent/US20160034786A1/en,https://patentimages.storage.googleapis.com/fb/94/eb/3a42d471c45672/US20160034786A1-20160204-D00000.png
US-2006208870-A1,Method for the machine learning of frequent chronicles in an alarm log for the monitoring of dynamic systems ,France Telecom,"Christophe Dousson, Fabrice Clerot, Francoise Fessant",2003-05-27,2004-05-25,2006-09-21,,https://patents.google.com/patent/US20060208870A1/en,https://patentimages.storage.googleapis.com/85/b6/5f/e527f8c0eb16c6/US20060208870A1-20060921-D00000.png
US-2016140436-A1,Face Detection Using Machine Learning ,"Beijing Kuangshi Technology Co., Ltd.","Qi Yin, Zhimin Cao, Kai Jia",2014-11-15,2014-11-15,2016-05-19,,https://patents.google.com/patent/US20160140436A1/en,https://patentimages.storage.googleapis.com/51/36/b5/3764d3a5ea0f2e/US20160140436A1-20160519-D00000.png
US-2010137734-A1,System and method for brain machine interface (bmi) control using reinforcement learning ,"Digiovanna John F, Babak Mahmoudi, Mitzelfelt Jeremiah D, Sanchez Justin C, Principe Jose C","John F. Digiovanna, Babak Mahmoudi, Jeremiah D. Mitzelfelt, Justin C. Sanchez, Jose C. Principe",2007-05-02,2008-04-25,2010-06-03,,https://patents.google.com/patent/US20100137734A1/en,https://patentimages.storage.googleapis.com/0f/71/34/8178cd1046f571/US20100137734A1-20100603-D00000.png
US-9704054-B1,Cluster-trained machine learning for image processing ,"Amazon Technologies, Inc.","Marshall Friend Tappen, Avinash Aghoram Ravichandran, Hakan Boyraz, Baoyuan Liu",2015-09-30,2015-09-30,2017-07-11,2017-07-11,https://patents.google.com/patent/US9704054B1/en,https://patentimages.storage.googleapis.com/06/46/20/01ddc6bd6925bb/US09704054-20170711-D00000.png
JP-2005182696-A,"Machine learning system and method, and computer program ","Fuji Xerox Co Ltd, 富士ゼロックス株式会社","Hiroshi Masuichi, Tomoko Okuma, Daigo Sugihara, Hiroki Yoshimura, 宏樹 吉村, 博 増市, 智子 大熊, 大悟 杉原",2003-12-24,2003-12-24,2005-07-07,,https://patents.google.com/patent/JP2005182696A/en,https://patentimages.storage.googleapis.com/7c/d2/7c/5e901b58b48bf6/2005182696-3.png
US-6961914-B1,Method and apparatus for selecting input points to train a machine learning model for extraction ,"Cadence Design Systems, Inc.","Steven Teig, Arindam Chatterjee",2002-01-31,2002-12-31,2005-11-01,2005-11-01,https://patents.google.com/patent/US6961914B1/en,https://patentimages.storage.googleapis.com/05/5b/1d/a4633f921ef907/US06961914-20051101-D00000.png
US-9336494-B1,Re-training a machine learning model ,"Context Relevant, Inc.","Stephen Purpura, James E. Walsh, Dustin Lundring Rigg Hillard",2012-08-20,2013-08-16,2016-05-10,2016-05-10,https://patents.google.com/patent/US9336494B1/en,https://patentimages.storage.googleapis.com/ce/a7/0a/930f51642aaa09/US09336494-20160510-D00000.png
US-8423487-B1,Machine learning approach to wave height prediction ,The United States Of America As Represented By The Secretary Of The Navy,Stuart H. Rubin,2010-08-11,2010-08-11,2013-04-16,2013-04-16,https://patents.google.com/patent/US8423487B1/en,https://patentimages.storage.googleapis.com/53/cd/be/f3e600726cd1fb/US08423487-20130416-D00000.png
US-8965814-B1,Selection of most effective machine learning kernel from a training set of documents ,Symantec Corporation,Venkat Rangan,2012-03-15,2012-03-15,2015-02-24,2015-02-24,https://patents.google.com/patent/US8965814B1/en,https://patentimages.storage.googleapis.com/fd/32/c5/88c37060c625a4/US08965814-20150224-D00000.png
US-9594905-B1,Framework for efficient security coverage of mobile software applications using machine learning ,"Fireeye, Inc.","Osman Abdoul Ismael, Dawn Song, Phung-Te Ha, Peter J. Gilbert, Hui Xue",2013-02-23,2015-10-12,2017-03-14,2017-03-14,https://patents.google.com/patent/US9594905B1/en,https://patentimages.storage.googleapis.com/f7/d3/70/47a7f009b004a3/US09594905-20170314-D00000.png
US-7243102-B1,Machine directed improvement of ranking algorithms ,Microsoft Corporation,"Ramez Naam, Nicole Ashley Hamilton, Oliver Hurst-Hiller, Brett D. Brewer",2004-07-01,2004-07-30,2007-07-10,2007-07-10,https://patents.google.com/patent/US7243102B1/en,https://patentimages.storage.googleapis.com/US7243102B1/US07243102-20070710-D00000.png
US-RE43255-E,Machine learning based upon feedback from contact center analysis ,"Verint Americas, Inc.","Christopher Douglas Blair, Roger Louis Keenan",1996-09-26,2006-08-24,2012-03-20,2012-03-20,https://patents.google.com/patent/USRE43255E1/en,https://patentimages.storage.googleapis.com/f9/68/f3/cf1eaed9574ea6/USRE043255-20120320-D00000.png
US-8412466-B2,"Rapid method of pattern recognition, machine learning, and automated genotype classification through correlation analysis of dynamic signals ","Canon U.S. Life Sciences, Inc.",Sami KANDERIAN,2009-04-13,2010-04-13,2013-04-02,2013-04-02,https://patents.google.com/patent/US8412466B2/en,https://patentimages.storage.googleapis.com/7a/fe/a2/15a5953d0e02aa/US08412466-20130402-D00001.png
CN-1460947-A,Text classification incremental training learning method supporting vector machine by compromising key words ,"北京大学计算机科学技术研究所, 北京北大方正技术研究院有限公司",孙晋文,2003-06-13,2003-06-13,2003-12-10,,https://patents.google.com/patent/CN1460947A/en,
US-2015242463-A1,"Systems, apparatuses, and methods for deep learning of feature detectors with sparse coding ","Tsung-Han Lin, Hsiang-Tsung Kung","Tsung-Han Lin, Hsiang-Tsung Kung",2014-02-25,2014-06-20,2015-08-27,,https://patents.google.com/patent/US20150242463A1/en,https://patentimages.storage.googleapis.com/40/69/26/a57e156c7ba69c/US20150242463A1-20150827-D00000.png
US-2016142266-A1,Extracting dependencies between network assets using deep learning ,Battelle Memorial Institute,"Thomas E. Carroll, Satish Chikkagoudar, Thomas W. Edgar, Kiri J. Oler, Kristine M. Arthur, Daniel M. Johnson, Lars J. Kangas",2014-11-19,2014-11-19,2016-05-19,,https://patents.google.com/patent/US20160142266A1/en,https://patentimages.storage.googleapis.com/2f/61/a2/d1485265ae895d/US20160142266A1-20160519-D00000.png
US-6529887-B1,Agent learning machine ,"Agency Of Industrial Science And Technology, Advanced Telecommunication Research Institute International","Kenji Doya, Mitsuo Kawato",1998-07-17,1999-07-08,2003-03-04,2003-03-04,https://patents.google.com/patent/US6529887B1/en,https://patentimages.storage.googleapis.com/d2/64/e0/31c84f071a1c6b/US06529887-20030304-D00000.png
US-7464264-B2,Training filters for detecting spasm based on IP addresses and text-related features ,Microsoft Corporation,"Joshua T. Goodman, Robert L. Rounthwaite, Geoffrey J. Hulten, Wen-tau Yih",2003-06-04,2004-03-25,2008-12-09,2008-12-09,https://patents.google.com/patent/US7464264B2/en,
US-5684929-A,Method and apparatus for determining the limit on learning machine accuracy imposed by data quality ,Lucent Technologies Inc.,"Corinna Cortes, Lawrence David Jackel",1994-10-27,1994-10-27,1997-11-04,1997-11-04,https://patents.google.com/patent/US5684929A/en,https://patentimages.storage.googleapis.com/pages/US5684929-2.png
US-8266148-B2,Method and system for business intelligence analytics on unstructured data ,"Aumni Data, Inc.","Aloke Guha, Joan Wrabetz, Shumin Wu, Venky Madireddi",2008-10-07,2009-10-07,2012-09-11,2012-09-11,https://patents.google.com/patent/US8266148B2/en,https://patentimages.storage.googleapis.com/6f/0e/7b/97e458b59646e8/US08266148-20120911-D00000.png
US-8266698-B1,Using machine infection characteristics for behavior-based detection of malware ,Symantec Corporation,"Vijay Seshardi, Zulfikar Ramzan, Sourabh Satish, Chandrasekhar Kalle",2009-03-09,2009-03-09,2012-09-11,2012-09-11,https://patents.google.com/patent/US8266698B1/en,https://patentimages.storage.googleapis.com/3e/36/f7/eb09266f9f8394/US08266698-20120911-D00000.png
US-7552030-B2,System and method for learning patterns of behavior and operating a monitoring and response system based thereon ,Honeywell International Inc.,"Valerie Guralnik, Karen Z. Haigh, Steven A. Harp",2002-01-22,2003-01-10,2009-06-23,2009-06-23,https://patents.google.com/patent/US7552030B2/en,https://patentimages.storage.googleapis.com/US7552030B2/US07552030-20090623-D00000.png
US-7424619-B1,System and methods for anomaly detection and adaptive learning ,The Trustees Of Columbia University In The City Of New York,"Wei Fan, Salvatore J. Stolfo",2001-10-11,2002-10-11,2008-09-09,2008-09-09,https://patents.google.com/patent/US7424619B1/en,
US-7139764-B2,Dynamic learning and knowledge representation for data mining ,Lee Shih-Jong J,Shih-Jong J. Lee,2003-06-25,2003-06-25,2006-11-21,2006-11-21,https://patents.google.com/patent/US7139764B2/en,
US-2009204558-A1,Method for training a learning machine having a deep multi-layered network with labeled and unlabeled training data ,"Nec Laboratories America, Inc.","Jason Weston, Ronan Collobert",2008-02-07,2009-02-06,2009-08-13,,https://patents.google.com/patent/US20090204558A1/en,
CN-103702416-A,Semi-supervised learning indoor positioning method based on support vector machine ,北京交通大学,"赵军辉, 曾龙基, 杨涛, 杜家娇",2013-12-24,2013-12-24,2014-04-02,,https://patents.google.com/patent/CN103702416A/en,
US-7386527-B2,Effective multi-class support vector machine classification ,"Kofax, Inc.","Christopher K. Harris, Mauritius A. R. Schmidtler",2002-12-06,2003-04-10,2008-06-10,2008-06-10,https://patents.google.com/patent/US7386527B2/en,
US-2014278424-A1,Kernel deep convex networks and end-to-end learning ,Microsoft Corporation,"Li Deng, Xiaodeng He, Gokhan Tur, Dilek Hakkani-Tur",2013-03-13,2013-03-13,2014-09-18,,https://patents.google.com/patent/US20140278424A1/en,https://patentimages.storage.googleapis.com/1c/41/a4/3633eaf93f099f/US20140278424A1-20140918-D00000.png
US-6697769-B1,Method and apparatus for fast machine training ,Microsoft Corporation,"Joshua Goodman, Robert Moore",2000-01-21,2000-01-21,2004-02-24,2004-02-24,https://patents.google.com/patent/US6697769B1/en,https://patentimages.storage.googleapis.com/68/49/1a/5be7c60b3716b1/US06697769-20040224-D00000.png
CN-1916992-A,"Learning machine in interactive mode, and its action method ",陈修志,陈修志,2005-08-19,2005-08-19,2007-02-21,,https://patents.google.com/patent/CN1916992A/en,
US-2006224535-A1,Action selection for reinforcement learning using influence diagrams ,Microsoft Corporation,"David Chickering, Timothy Paek, Eric Horvitz",2005-03-08,2005-06-29,2006-10-05,,https://patents.google.com/patent/US20060224535A1/en,https://patentimages.storage.googleapis.com/16/e1/b2/eb4bf069d750a5/US20060224535A1-20061005-D00000.png
US-2013142418-A1,Ranking and selecting representative video images ,"Roelof van Zwol, Lluis Garcia Pueyo","Roelof van Zwol, Lluis Garcia Pueyo",2011-12-06,2011-12-06,2013-06-06,,https://patents.google.com/patent/US20130142418A1/en,https://patentimages.storage.googleapis.com/d7/e5/78/fcf40590ca59ae/US20130142418A1-20130606-D00000.png
CN-201812396-U,Computer type calligraphy and painting learning machine ,朱嘉慧,"朱嘉慧, 朱明�",2010-07-16,2010-07-16,2011-04-27,2011-04-27,https://patents.google.com/patent/CN201812396U/en,
CN-201251875-Y,Network desk-type integral electronic-technology synchronic learning machine ,鲁润泽;林  瑾;张风琴,鲁润泽,2008-02-22,2008-02-22,2009-06-03,2009-06-03,https://patents.google.com/patent/CN201251875Y/en,
US-6662170-B1,System and method for boosting support vector machines ,International Business Machines Corporation,"Byron Edward Dom, Jianchang Mao, Dmitry Pavlov",2000-08-22,2000-08-22,2003-12-09,2003-12-09,https://patents.google.com/patent/US6662170B1/en,https://patentimages.storage.googleapis.com/89/8a/e5/71846ed0ed616f/US06662170-20031209-D00000.png
US-8873813-B2,"Application of Z-webs and Z-factors to analytics, search engine, learning, recognition, natural language, and other utilities ","Z Advanced Computing, Inc.","Saied Tadayon, Bijan Tadayon",2012-09-17,2013-02-28,2014-10-28,2014-10-28,https://patents.google.com/patent/US8873813B2/en,https://patentimages.storage.googleapis.com/37/58/05/17c7d4222ee416/US08873813-20141028-D00000.png
JP-2003196636-A,"Notation error detection processing method using machine learning method having teacher, its processing device and its processing program ","Communication Research Laboratory, 独立行政法人通信総合研究所","Hitoshi Isahara, Maki Murata, 均 井佐原, 真樹 村田",2001-12-26,2001-12-26,2003-07-11,,https://patents.google.com/patent/JP2003196636A/en,
CN-103763515-A,Video anomaly detection method based on machine learning ,浙江工业大学,"张永良, 张智勤, 董灵平, 阮盛鹏, 肖刚",2013-12-24,2013-12-24,2014-04-30,,https://patents.google.com/patent/CN103763515A/en,
CN-103853979-A,Program identification method and device based on machine learning ,"北京奇虎科技有限公司, 奇智软件（北京）有限公司","董毅, 周辉",2010-12-31,2010-12-31,2014-06-11,,https://patents.google.com/patent/CN103853979A/en,
CN-102096934-A,Human face cartoon generating method based on machine learning ,电子科技大学,"张春婷, 李宏亮",2011-01-27,2011-01-27,2011-06-15,,https://patents.google.com/patent/CN102096934A/en,
CN-104714852-A,Parameter synchronization optimization method and system suitable for distributed machine learning ,华中科技大学,"廖小飞, 王思远, 范学鹏, 金海�, 姚琼杰",2015-03-17,2015-03-17,2015-06-17,,https://patents.google.com/patent/CN104714852A/en,
US-2014337255-A1,"Scalable, memory-efficient machine learning and prediction for ensembles of decision trees for homogeneous and heterogeneous datasets ","Wise Io, Inc.",Damian Ryan Eads,2013-05-07,2014-05-07,2014-11-13,,https://patents.google.com/patent/US20140337255A1/en,https://patentimages.storage.googleapis.com/47/6f/47/07b59dc4d30a53/US20140337255A1-20141113-D00000.png
US-2016078363-A1,Method for Developing Machine Operation Classifier Using Machine Learning ,Caterpillar Inc.,"Benjamin Hodel, Sangkyum Kim, Paul Lee",2014-09-17,2014-09-17,2016-03-17,,https://patents.google.com/patent/US20160078363A1/en,https://patentimages.storage.googleapis.com/79/62/f6/27634857f2f79b/US20160078363A1-20160317-D00000.png
US-2015347101-A1,R-language integration with a declarative machine learning language ,International Business Machines Corporation,"Matthias Boehm, Douglas R. Burdick, Stefan Burnicki, Berthold Reinwald, Shirish Tatikonda",2014-06-02,2014-06-02,2015-12-03,,https://patents.google.com/patent/US20150347101A1/en,https://patentimages.storage.googleapis.com/cc/b5/65/af997eaebe53f7/US20150347101A1-20151203-D00000.png
US-2013198187-A1,Classifying Data Using Machine Learning ,Business Objects Software Limited,Sherif Botros,2012-01-31,2012-01-31,2013-08-01,,https://patents.google.com/patent/US20130198187A1/en,https://patentimages.storage.googleapis.com/d8/78/eb/104cbb511d44e6/US20130198187A1-20130801-D00000.png
US-2016217388-A1,"Machine learning heterogeneous edge device, method, and system ","Preferred Networks, Inc.","Daisuke Okanohara, Justin B. Clayton, Toru Nishikawa, Shohei Hido, Nobuyuki Kubota, Nobuyuki Ota, Seiya Tokui",2015-01-22,2015-01-22,2016-07-28,,https://patents.google.com/patent/US20160217388A1/en,https://patentimages.storage.googleapis.com/79/cf/bc/2e3308262b1692/US20160217388A1-20160728-D00000.png
US-2014223284-A1,"Machine learning data annotation apparatuses, methods and systems ","Brokersavant, Inc.","Claiborne R. Rankin, JR., Emilia Antonova Apostolova",2013-02-01,2014-01-31,2014-08-07,,https://patents.google.com/patent/US20140223284A1/en,https://patentimages.storage.googleapis.com/1b/31/77/450b463cead8ee/US20140223284A1-20140807-D00000.png
US-2015227741-A1,Application Execution Control Utilizing Ensemble Machine Learning For Discernment ,"Cylance, Inc.","Ryan Permeh, Derek A. Soeder, Glenn Chisholm, Braden Russell, Gary Golomb, Matthew Wolff, Stuart McClure",2014-02-07,2015-02-06,2015-08-13,,https://patents.google.com/patent/US20150227741A1/en,https://patentimages.storage.googleapis.com/23/21/38/e03be6f636c4ca/US20150227741A1-20150813-D00000.png
WO-2016004075-A1,Interactive interfaces for machine learning model evaluations ,"Amazon Technologies, Inc.","Polly Po Yee Lee, Nicolle M. Correa, Leo Parker Dirac, Aleksandr Mikhaylovich Ingerman, Sriram Krishnan, Jin Li, Sudhakar Rao Puvvadi, Saman Zarandioon, Charles Eric Dannaker, Rakesh Ramakrishnan, Tianming Zheng, Donghui Zhuo, Tarun Agarwal, Robert Matthias Steele, Jun Qian, Michael Brueckner, Ralf Herbrich, Daniel BLICK",2014-06-30,2015-06-30,2016-01-07,,https://patents.google.com/patent/WO2016004075A1/en,
US-2012215727-A1,Automatic data cleaning for machine learning classifiers ,Thomson Reuters Global Resources,"Hassan H. Malik, Mans Olof-Ors",2011-02-22,2011-03-11,2012-08-23,,https://patents.google.com/patent/US20120215727A1/en,https://patentimages.storage.googleapis.com/06/ac/6e/dfcedd5b0af3ad/US20120215727A1-20120823-D00000.png
US-2015201895-A1,Supervised machine learning technique for reduction of radiation dose in computed tomography imaging ,The University Of Chicago,Kenji Suzuki,2012-08-31,2013-08-30,2015-07-23,,https://patents.google.com/patent/US20150201895A1/en,https://patentimages.storage.googleapis.com/39/a9/08/aa6ad615a95ea3/US20150201895A1-20150723-D00000.png
US-2014369597-A1,System and method of classifier ranking for incorporation into enhanced machine learning ,"Texifter, LLC","Stuart William Shulman, Mark James Hoy",2013-06-17,2013-06-17,2014-12-18,,https://patents.google.com/patent/US20140369597A1/en,https://patentimages.storage.googleapis.com/3e/3f/74/d37e5cae8d8871/US20140369597A1-20141218-D00000.png
US-2016105364-A1,Network traffic flow management using machine learning ,"Nec Laboratories America, Inc.","Konstantinos Kanonakis, Yawei Yin, Mahmoud Sayed",2014-10-13,2015-09-03,2016-04-14,,https://patents.google.com/patent/US20160105364A1/en,https://patentimages.storage.googleapis.com/7b/b4/3b/d3c45282e7b5d5/US20160105364A1-20160414-D00000.png
US-2016025028-A1,Adaptive Machine Learning Method To Predict And Control Engine Combustion ,The Regents Of The University Of Michigan,Adam Vaughan,2014-07-22,2015-07-22,2016-01-28,,https://patents.google.com/patent/US20160025028A1/en,https://patentimages.storage.googleapis.com/f8/ee/e1/a7d49a7dcff37a/US20160025028A1-20160128-D00000.png
US-2016358102-A1,Machine learning system flow authoring tool ,"Facebook, Inc.","Stuart Michael Bowers, Hussein Mohamed Hassan Mehanna, Alisson Gusatti Azzolini, Jeffrey Scott Dunn, Rodrigo Bouchardet Farnham, James Robert Paton, Aleksandr Sidorov, Pamela Shen Vagata, Xiaowen XIE",2015-06-05,2015-06-05,2016-12-08,,https://patents.google.com/patent/US20160358102A1/en,https://patentimages.storage.googleapis.com/70/b7/f3/60978054dfcd57/US20160358102A1-20161208-D00000.png
US-2015206067-A1,Weight generation in machine learning ,California Institute Of Technology,"Yaser Said Abu-Mostafa, Carlos Roberto Gonzalez",2013-11-22,2014-08-05,2015-07-23,,https://patents.google.com/patent/US20150206067A1/en,https://patentimages.storage.googleapis.com/c3/16/55/51a57fe55c4371/US20150206067A1-20150723-D00000.png
WO-2008109769-A1,Machine learning for transliteration ,Google Inc.,"Lalitesh Katragadda, Pawan Deshpande, Anupama Dutta, Nitin Arora",2007-03-06,2008-03-06,2008-09-12,,https://patents.google.com/patent/WO2008109769A1/en,
US-2009094177-A1,Method for efficient machine-learning classification of multiple text categories ,Kazuo Aoki,Kazuo Aoki,2007-10-05,2007-10-05,2009-04-09,,https://patents.google.com/patent/US20090094177A1/en,https://patentimages.storage.googleapis.com/US20090094177A1/US20090094177A1-20090409-D00000.png
US-2015148953-A1,Discrepancy detection apparatus and methods for machine learning ,Brain Corporation,"Patryk Laurent, Jean-Baptiste Passot, Filip Ponulak, Eugene Izhikevich",2013-11-22,2013-11-22,2015-05-28,,https://patents.google.com/patent/US20150148953A1/en,https://patentimages.storage.googleapis.com/3b/97/23/e7271a303faa2f/US20150148953A1-20150528-D00000.png
US-2016148077-A1,Systems and methods for machine learning enhanced by human measurements ,President And Fellows Of Harvard College,"David Cox, Walter Scheirer, Samuel ANTHONY, Ken Nakayama",2013-06-28,2014-06-26,2016-05-26,,https://patents.google.com/patent/US20160148077A1/en,https://patentimages.storage.googleapis.com/ed/2c/65/dad5384ec1919a/US20160148077A1-20160526-D00000.png
US-2015347519-A1,Machine learning based search improvement ,Apple Inc.,"John M. Hornkvist, Gaurav Kapoor",2014-05-30,2015-05-26,2015-12-03,,https://patents.google.com/patent/US20150347519A1/en,https://patentimages.storage.googleapis.com/20/af/26/79be9c47bf9329/US20150347519A1-20151203-D00000.png
US-2015293976-A1,Context-Sensitive Search Using a Deep Learning Model ,Microsoft Corporation,"Chenlei Guo, Jianfeng Gao, Ye-Yi Wang, Li Deng, Xiaodong He",2014-04-14,2014-04-14,2015-10-15,,https://patents.google.com/patent/US20150293976A1/en,https://patentimages.storage.googleapis.com/91/2a/8f/f85501e2f4b2f3/US20150293976A1-20151015-D00000.png
US-9013496-B2,Rendering global light transport in real-time using machine learning ,"Microsoft Technology Licensing, Llc","Jiaping Wang, Peiran Ren, Minmin Gong, Xin Tong, Stephen S. Lin, Baining Guo",2012-06-19,2012-06-19,2015-04-21,2015-04-21,https://patents.google.com/patent/US9013496B2/en,https://patentimages.storage.googleapis.com/be/05/c3/59ccb4edd97e53/US09013496-20150421-D00000.png
US-8812417-B2,Hierarchical based sequencing machine learning model ,"InsideSales.com, Inc.","Tony Ramon Martinez, Xinchuan Zeng, Richard Glenn Morris",2012-08-20,2012-08-20,2014-08-19,2014-08-19,https://patents.google.com/patent/US8812417B2/en,https://patentimages.storage.googleapis.com/13/98/55/a8960c4527d05f/US08812417-20140819-D00000.png
US-8464194-B1,Machine learning approach to correct lithographic hot-spots ,International Business Machines Corporation,"Kanak Behari Agarwal, Shayak Banerjee",2011-12-16,2011-12-16,2013-06-11,2013-06-11,https://patents.google.com/patent/US8464194B1/en,https://patentimages.storage.googleapis.com/1b/5c/85/da0dc2b420f60c/US08464194-20130611-D00000.png
US-9690938-B1,Methods and apparatus for machine learning based malware detection ,"Invincea, Inc.","Joshua Daniel Saxe, Konstantin Berlin",2015-08-05,2016-08-04,2017-06-27,2017-06-27,https://patents.google.com/patent/US9690938B1/en,https://patentimages.storage.googleapis.com/5e/83/c8/42841cb2e60fb6/US09690938-20170627-D00000.png
US-9514414-B1,Systems and methods for identifying and categorizing electronic documents through machine learning ,Palantir Technologies Inc.,"James Rosswog, Matthew Gerhardt, Eric Raboin, Daniel ERENRICH, Arseny Bogomolov, Cooper Bills, Eric Anderson, Jack Grossman, Kevin Simons, Matthew Levan, Nathaniel Klein, Ryan Beiermeister, Tim O'Brien",2015-12-11,2016-04-01,2016-12-06,2016-12-06,https://patents.google.com/patent/US9514414B1/en,https://patentimages.storage.googleapis.com/41/88/be/e54ab2684e6697/US09514414-20161206-D00000.png
US-2016093048-A1,Deep similarity learning for multimodal medical images ,Siemens Healthcare Gmbh,"Xi Cheng, Li Zhang, Yefeng Zheng",2014-09-25,2015-09-25,2016-03-31,,https://patents.google.com/patent/US20160093048A1/en,https://patentimages.storage.googleapis.com/5e/ce/21/6d0eac4c474b47/US20160093048A1-20160331-D00000.png
US-5483620-A,Learning machine synapse processor system apparatus ,International Business Machines Corp.,"Gerald G. Pechanek, Stamatis Vassiliadis, Jose G. Delgado-Frias",1990-05-22,1995-03-09,1996-01-09,1996-01-09,https://patents.google.com/patent/US5483620A/en,https://patentimages.storage.googleapis.com/pages/US5483620-10.png
US-2013325774-A1,Learning stochastic apparatus and methods ,Brain Corporation,"Oleg Sinyavskiy, Olivier Coenen",2012-06-04,2012-06-04,2013-12-05,,https://patents.google.com/patent/US20130325774A1/en,https://patentimages.storage.googleapis.com/ae/5b/f5/b957cf11d39b2c/US20130325774A1-20131205-D00000.png
US-7587307-B2,Method and apparatus for evaluating machine translation quality ,Xerox Corporation,"Nicola Cancedda, Kenji Yamada",2003-12-18,2003-12-18,2009-09-08,2009-09-08,https://patents.google.com/patent/US7587307B2/en,
US-7639868-B1,Automated learning of model classifications ,Drexel University,"William C. Regli, Cheuk Yiu Ip, Leonard Sieger",2003-06-16,2004-06-16,2009-12-29,2009-12-29,https://patents.google.com/patent/US7639868B1/en,
