US-7464040-B2,Apparatus and method for processing and/or for providing healthcare information and/or healthcare-related information ,Raymond Anthony Joao,Raymond Anthony Joao,1999-12-18,2000-12-15,2008-12-09,2008-12-09,https://patents.google.com/patent/US7464040B2/en,https://patentimages.storage.googleapis.com/US7464040B2/US07464040-20081209-D00000.png
US-7490048-B2,Apparatus and method for processing and/or for providing healthcare information and/or healthcare-related information ,Raymond Anthony Joao,Raymond Anthony Joao,1999-12-18,2001-11-14,2009-02-10,2009-02-10,https://patents.google.com/patent/US7490048B2/en,https://patentimages.storage.googleapis.com/US7490048B2/US07490048-20090210-D00000.png
US-5933809-A,Computer software for processing medical billing record information ,"Medcom Solutions, Inc.","William A. Hunt, Elizabeth F. Yauch, Mark Denovich",1996-02-29,1996-02-29,1999-08-03,1999-08-03,https://patents.google.com/patent/US5933809A/en,https://patentimages.storage.googleapis.com/pages/US5933809-1.png
US-6182891-B1,"Electronic bankbook, and processing system for financial transaction information using electronic bankbook ",Ntt Data Communications Systems Corporation,"Nobuo Furuhashi, Kenichiro Inoue, Tomoo Takeda, Sigefumi Takahashi, Atsumi Tokumasu, Takafumi Kobayashi, Noriyuki Iwase",1994-07-18,1999-08-09,2001-02-06,2001-02-06,https://patents.google.com/patent/US6182891B1/en,https://patentimages.storage.googleapis.com/a4/95/82/5778e923a2dcfa/US06182891-20010206-D00000.png
US-6283761-B1,Apparatus and method for processing and/or for providing healthcare information and/or healthcare-related information ,Raymond Anthony Joao,Raymond Anthony Joao,1992-09-08,1999-12-31,2001-09-04,2001-09-04,https://patents.google.com/patent/US6283761B1/en,https://patentimages.storage.googleapis.com/75/c6/b6/eb5a9c692aafdd/US06283761-20010904-D00000.png
US-5809478-A,Method for accessing and evaluating information for processing an application for insurance ,Allstate Insurance Company,"N. J. Greco, E. M. White, S. G. Fine, G. R. Haught, E. M. Pihl, G. Bullock, James M. Batman, W. Gillespie, D. Roland, K. Babij",1995-12-08,1995-12-08,1998-09-15,1998-09-15,https://patents.google.com/patent/US5809478A/en,https://patentimages.storage.googleapis.com/pages/US5809478-1.png
US-6636587-B1,Information reception processing method and computer-telephony integration system ,"Hitachi, Ltd.","Yasuhiko Nagai, Susumu Matsui",1997-06-25,1998-06-24,2003-10-21,2003-10-21,https://patents.google.com/patent/US6636587B1/en,https://patentimages.storage.googleapis.com/d2/0a/71/8bd299a8493ba8/US06636587-20031021-D00000.png
US-5612720-A,Systems for processing information and identifying individual ,Hitachi Ltd.,"Jun Ito, Hiroyuki Kumai, Yasumasa Matsuda, Akira Nakajima, Yoshiisa Inoue, Hiroyuki Koreeda, Shigeto Oheda",1993-01-20,1995-06-07,1997-03-18,1997-03-18,https://patents.google.com/patent/US5612720A/en,https://patentimages.storage.googleapis.com/pages/US5612720-1.png
US-7634295-B2,"Communication system, settlement management apparatus and method, portable information terminal and information processing method, and program ",Sony Corporation,"Hirofumi Hayaashi, Kohei Yokota, Toru Kuwahara",2003-03-19,2004-03-16,2009-12-15,2009-12-15,https://patents.google.com/patent/US7634295B2/en,https://patentimages.storage.googleapis.com/US7634295B2/US07634295-20091215-D00000.png
US-6438251-B1,Method of processing image information and method of preventing forgery of certificates or the like ,Kabushiki Kaisha Toshiba,Takashi Yamaguchi,1997-12-03,1998-12-02,2002-08-20,2002-08-20,https://patents.google.com/patent/US6438251B1/en,https://patentimages.storage.googleapis.com/69/c9/2c/ce395c9568710a/US06438251-20020820-D00000.png
US-6769032-B1,Augmented processing of information objects in a distributed messaging framework in a computer network ,"E.Piphany, Inc.","Dinesh Katiyar, Eshwar Belani, Pradeep Javangula",1998-05-15,1999-05-14,2004-07-27,2004-07-27,https://patents.google.com/patent/US6769032B1/en,https://patentimages.storage.googleapis.com/85/eb/5e/81699d772e2d57/US06769032-20040727-D00000.png
US-6014135-A,Collaboration centric document processing environment using an information centric visual user interface and information presentation method ,Netscape Communications Corp.,Antonio M. Fernandes,1997-04-04,1997-04-04,2000-01-11,2000-01-11,https://patents.google.com/patent/US6014135A/en,https://patentimages.storage.googleapis.com/pages/US6014135-1.png
US-4661005-A,"Spittable keyboard for word processing, typing and other information input systems ",Creative Associates,Roy J. Lahr,1984-01-16,1984-01-16,1987-04-28,1987-04-28,https://patents.google.com/patent/US4661005A/en,https://patentimages.storage.googleapis.com/pages/US4661005-10.png
US-5070470-A,Methods for handling calendar information in a data processing system ,International Business Machines Corporation,"Keith J. Scully, Harinder S. Singh",1987-12-18,1987-12-18,1991-12-03,1991-12-03,https://patents.google.com/patent/US5070470A/en,https://patentimages.storage.googleapis.com/pages/US5070470-1.png
US-7047033-B2,"Methods and apparatus for analyzing, processing and formatting network information such as web-pages ",Infogin Ltd,Eran Shmuel Wyler,2000-02-01,2001-01-31,2006-05-16,2006-05-16,https://patents.google.com/patent/US7047033B2/en,
US-5379423-A,Information life cycle processor and information organizing method using it ,"Hitachi, Ltd., Hitachi Microcomputer Engineering Ltd., Hitachi Chubu Software, Ltd.","Hideo Mutoh, Keiji Moki, Takehiko Shibayama",1988-09-28,1993-06-01,1995-01-03,1995-01-03,https://patents.google.com/patent/US5379423A/en,https://patentimages.storage.googleapis.com/pages/US5379423-1.png
US-5109512-A,Process for dispatching tasks among multiple information processors ,International Business Machines Corporation,"James E. Bahr, Michael J. Corrigan, Diane L. Knipfer, Lynn A. McMahon, Charlotte B. Metzger",1990-05-31,1990-05-31,1992-04-28,1992-04-28,https://patents.google.com/patent/US5109512A/en,https://patentimages.storage.googleapis.com/pages/US5109512-1.png
US-5577164-A,Incorrect voice command recognition prevention and recovery processing method and apparatus ,Canon Kabushiki Kaisha,"Kazue Kaneko, Keiichi Sakai",1994-01-28,1995-01-23,1996-11-19,1996-11-19,https://patents.google.com/patent/US5577164A/en,https://patentimages.storage.googleapis.com/pages/US5577164-1.png
US-7047550-B1,System for processing program information ,Matsushita Electric Industrial Co. Ltd.,"Hideki Yasukawa, Yoshihiro Noguchi, Masaki Hoshida, Tsuyoshi Ueno, Fumiyuki Kato, Yutaka Tomioka, Hayashi Itou, Takao Isogawa",1997-07-03,1998-07-01,2006-05-16,2006-05-16,https://patents.google.com/patent/US7047550B1/en,https://patentimages.storage.googleapis.com/US7047550B1/US07047550-20060516-D00000.png
US-5802179-A,Information processor having two-dimensional bar code processing function ,Sharp Kabushiki Kaisha,Kenji Yamamoto,1995-05-18,1996-03-22,1998-09-01,1998-09-01,https://patents.google.com/patent/US5802179A/en,https://patentimages.storage.googleapis.com/pages/US5802179-1.png
US-5251311-A,Method and apparatus for processing information and providing cache invalidation information ,Nec Corporation,Hiroyoki Kasai,1989-10-12,1990-10-11,1993-10-05,1993-10-05,https://patents.google.com/patent/US5251311A/en,https://patentimages.storage.googleapis.com/pages/US5251311-1.png
US-7065710-B2,"Apparatus and method for processing information, and program and medium used therefor ",Sony Corporation,"Masakazu Hayashi, Hideyuki Agata, Eduardo Agusto Sciammarella, Makoto Imamura",2000-05-01,2001-04-27,2006-06-20,2006-06-20,https://patents.google.com/patent/US7065710B2/en,https://patentimages.storage.googleapis.com/39/1c/58/1d0e4e8b3acfd9/US07065710-20060620-D00008.png
US-6934046-B1,"Information processor, method for processing information and memory medium for storing program readable by computer ",Canon Kabushiki Kaisha,"Satoshi Nishikawa, Koji Nakagiri, Yasuo Mori",1999-11-02,2000-10-31,2005-08-23,2005-08-23,https://patents.google.com/patent/US6934046B1/en,https://patentimages.storage.googleapis.com/US6934046B1/US06934046-20050823-D00000.png
US-6226259-B1,Device and method for transmitting information device and method for processing information ,Canon Kabushiki Kaisha,Philippe Piret,1997-04-29,1998-03-06,2001-05-01,2001-05-01,https://patents.google.com/patent/US6226259B1/en,https://patentimages.storage.googleapis.com/9b/1f/41/dfa9319602cb1e/US06226259-20010501-D00000.png
US-5602566-A,"Small-sized information processor capable of scrolling screen in accordance with tilt, and scrolling method therefor ","Hitachi, Ltd.","Hiroshi Motosyuku, Hirobumi Yokosuka",1993-08-24,1994-08-23,1997-02-11,1997-02-11,https://patents.google.com/patent/US5602566A/en,https://patentimages.storage.googleapis.com/pages/US5602566-1.png
US-7379899-B1,Method and apparatus for verifying product sale transactions and processing product returns ,Nintendo Of America Inc.,Peter J. Junger,1998-11-13,1999-11-10,2008-05-27,2008-05-27,https://patents.google.com/patent/US7379899B1/en,https://patentimages.storage.googleapis.com/US7379899B1/US07379899-20080527-D00000.png
US-5845047-A,Method and apparatus for processing speech information using a phoneme environment ,Canon Kabushiki Kaisha,"Toshiaki Fukada, Yasunori Ohora, Yasuhiro Komori, Takashi Aso",1994-03-22,1995-03-20,1998-12-01,1998-12-01,https://patents.google.com/patent/US5845047A/en,https://patentimages.storage.googleapis.com/pages/US5845047-1.png
US-5600836-A,System and method for processing date-dependent information which spans one or two centuries ,"Turn Of The Century Solution, Inc.",Harvey Alter,1995-11-14,1995-11-14,1997-02-04,1997-02-04,https://patents.google.com/patent/US5600836A/en,https://patentimages.storage.googleapis.com/pages/US5600836-1.png
US-4084241-A,System for processing movement information of vehicle ,Toshihiro Tsumura,Toshihiro Tsumura,1974-10-19,1977-01-19,1978-04-11,1978-04-11,https://patents.google.com/patent/US4084241A/en,https://patentimages.storage.googleapis.com/pages/US4084241-1.png
US-4698778-A,Method of processing gradation information with variable magnification ,"Ricoh Company, Ltd.","Masahiro Ito, Noboru Murayama, Koichi Suziku, Kei Sato, Tsutomu Sato",1983-09-02,1984-08-31,1987-10-06,1987-10-06,https://patents.google.com/patent/US4698778A/en,https://patentimages.storage.googleapis.com/pages/US4698778-1.png
US-6246958-B1,Apparatus and method for processing information and apparatus and method for displaying image ,Sony Corporation,Chiharu Hirono,1997-03-11,1998-03-05,2001-06-12,2001-06-12,https://patents.google.com/patent/US6246958B1/en,https://patentimages.storage.googleapis.com/b2/b4/65/f52b9822990e5a/US06246958-20010612-D00000.png
US-5446841-A,Multi-processor system having shared memory for storing the communication information used in communicating between processors ,"Hitachi, Ltd.","Masahiro Kitano, Yoshitaka Ohfusa, Katsuya Kohda, Keiichi Sasaki, Hiroyuki Okura, Katsumi Takeda",1991-06-15,1992-06-15,1995-08-29,1995-08-29,https://patents.google.com/patent/US5446841A/en,https://patentimages.storage.googleapis.com/pages/US5446841-1.png
US-6873356-B1,"Expansion unit, portable data processing apparatus and imaging device ","Fujitsu Limited, Fujitsu General Limited","Katsuhito Kanbe, Hidehiko Fuchida, Tosio Yoseyama, Mitsuo Maeda",1999-08-31,2000-08-30,2005-03-29,2005-03-29,https://patents.google.com/patent/US6873356B1/en,https://patentimages.storage.googleapis.com/c2/f3/21/b621aa7711780d/US06873356-20050329-D00000.png
US-5346789-A,Oriented biological material for optical information storage and processing ,"Cornell Research Foundation, Inc.","Aaron Lewis, Zhongping Chen, Hiroyuki Takei",1991-12-06,1992-11-30,1994-09-13,1994-09-13,https://patents.google.com/patent/US5346789A/en,https://patentimages.storage.googleapis.com/pages/US5346789-10.png
US-6115132-A,Printing system that transmits job information independently of print data ,Canon Kabushiki Kaisha,"Takuji Nakatsuma, Takashi Yagita, Junichi Takeda, Koichiro Wanda, Mitsuo Kimura, Takuya Kakehashi",1996-12-27,1997-12-24,2000-09-05,2000-09-05,https://patents.google.com/patent/US6115132A/en,https://patentimages.storage.googleapis.com/pages/US6115132-1.png
US-5729251-A,Information input/output system ,"Fuji Xerox Co., Ltd.",Tadashi Nakashima,1995-02-09,1996-02-05,1998-03-17,1998-03-17,https://patents.google.com/patent/US5729251A/en,https://patentimages.storage.googleapis.com/pages/US5729251-1.png
US-6059614-A,Modular information and processing center ,Lucent Technologies Inc.,"Kevin A. Shelby, Matthew S. Whalen",1996-11-20,1996-11-20,2000-05-09,2000-05-09,https://patents.google.com/patent/US6059614A/en,https://patentimages.storage.googleapis.com/pages/US6059614-1.png
US-5210844-A,System using selected logical processor identification based upon a select address for accessing corresponding partition blocks of the main memory ,"Hitachi, Ltd., Hitachi Computer Engineering Co., Ltd.","Nobuyuki Shimura, Kazuo Hibi, Yoshio Oshima",1988-09-29,1989-09-26,1993-05-11,1993-05-11,https://patents.google.com/patent/US5210844A/en,https://patentimages.storage.googleapis.com/pages/US5210844-2.png
US-5608866-A,System for measuring and analyzing operation of information processor ,Nec Corporation,Takashi Horikawa,1994-04-08,1995-04-10,1997-03-04,1997-03-04,https://patents.google.com/patent/US5608866A/en,https://patentimages.storage.googleapis.com/pages/US5608866-1.png
US-4677429-A,Vehicle information on-board processor ,Navistar International Transportation Corp.,Ronald W. Glotzbach,1983-12-01,1983-12-01,1987-06-30,1987-06-30,https://patents.google.com/patent/US4677429A/en,https://patentimages.storage.googleapis.com/pages/US4677429-1.png
US-6834346-B1,Content processing system ,Sony Corporation,"Yoshihito Ishibashi, Tateo Oishi, Tomoyuki Asano, Yoshitomo Osawa",1998-07-30,1999-07-30,2004-12-21,2004-12-21,https://patents.google.com/patent/US6834346B1/en,https://patentimages.storage.googleapis.com/d1/de/d0/06503f7f104013/US06834346-20041221-D00000.png
US-6728956-B2,"Data processor, program updating method and storage medium ",Canon Kabushiki Kaisha,Kenichiro Ono,1998-08-28,1999-08-24,2004-04-27,2004-04-27,https://patents.google.com/patent/US6728956B2/en,https://patentimages.storage.googleapis.com/1d/5d/c4/da9382806d98a1/US06728956-20040427-D00000.png
US-6486920-B2,Method and apparatus for producing program information and receiving apparatus for processing the program information ,"Matsushita Electric Industrial Co., Ltd.","Yuko Arai, Takeshi Nagao, Kenichi Fujita, Takayuki Suzuki",1997-12-19,1998-12-18,2002-11-26,2002-11-26,https://patents.google.com/patent/US6486920B2/en,https://patentimages.storage.googleapis.com/24/93/3e/f8ced98a4e5d81/US06486920-20021126-D00000.png
US-6266162-B1,Image communication apparatus for selectively controlling output of communication management information ,Canon Kabushiki Kaisha,"Koji Okamura, Yasuhide Ueno, Nobuyuki Hirai, Takashi Imai, Atsushi Ikeda",1994-11-14,1995-11-13,2001-07-24,2001-07-24,https://patents.google.com/patent/US6266162B1/en,https://patentimages.storage.googleapis.com/5c/b5/20/2ea7eb23f6361e/US06266162-20010724-D00000.png
US-5889597-A,Image processing apparatus and system having a detachable scanner unit ,Canon Kabushiki Kaisha,"Yoji Ara, Atsushi Noda",1994-06-01,1995-06-01,1999-03-30,1999-03-30,https://patents.google.com/patent/US5889597A/en,https://patentimages.storage.googleapis.com/pages/US5889597-1.png
US-6535985-B1,Data processing apparatus ,"Matsushita Electric Industrial Co., Ltd.","Mitsuaki Oshima, Yoshihiro Gohara, Yoshinori Kobayashi, Shozo Fujiwara, Tsuyoshi Uemura",1990-03-23,2000-05-30,2003-03-18,2003-03-18,https://patents.google.com/patent/US6535985B1/en,https://patentimages.storage.googleapis.com/64/e3/fa/9c5194b4040e92/US06535985-20030318-D00000.png
US-5552799-A,Display information conversion apparatus ,"Nintendo Co.,Ltd.",Sadao Hashiguchi,1993-07-27,1994-07-25,1996-09-03,1996-09-03,https://patents.google.com/patent/US5552799A/en,https://patentimages.storage.googleapis.com/pages/US5552799-1.png
US-7275987-B2,"Virtual world system, server computer and information processor ",Sony Computer Entertainment Inc.,"Keiso Shimakawa, Shuji Hiramatsu, Masakazu Suzuoki, Akio Ohba, Toyoshi Okada, Shigeru Enomoto, Muneki Shimada, Tomokazu Kake, Yousuke Kimoto, Kenjiro Komaki, Hiromasa Horie, Takahiro Fujii, Yuta Kimura, Hidehisa Onai",2000-10-12,2001-10-12,2007-10-02,2007-10-02,https://patents.google.com/patent/US7275987B2/en,https://patentimages.storage.googleapis.com/US7275987B2/US07275987-20071002-D00000.png
US-5510924-A,Voice information transfer system capable of easily performing voice information transfer using optical signal ,"Olympus Optical Co., Ltd.","Nobuo Terui, Takafumi Ohnishi, Kenji Furuta",1994-01-13,1995-04-06,1996-04-23,1996-04-23,https://patents.google.com/patent/US5510924A/en,https://patentimages.storage.googleapis.com/pages/US5510924-1.png
US-5361332-A,Method of commonly using font information for outputting information in a system having a plurality of information processing devices ,Canon Kabushiki Kaisha,"Masayuki Yoshida, Keiko Nakanishi",1990-10-09,1991-10-08,1994-11-01,1994-11-01,https://patents.google.com/patent/US5361332A/en,https://patentimages.storage.googleapis.com/pages/US5361332-1.png
US-4663751-A,Optical information processor for compensating offset ,"Hitachi, Ltd.","Toshimitsu Kaku, Yoshito Tsunoda, Takeshi Maeda, Shigeru Nakamura",1982-07-21,1983-07-20,1987-05-05,1987-05-05,https://patents.google.com/patent/US4663751A/en,https://patentimages.storage.googleapis.com/pages/US4663751-1.png
US-5485623-A,Information processor having high speed and safety resume system ,"Hitachi, Ltd.","Yoshiki Kurokawa, Kiyokazu Nishioka, Hideki Kamimaki, Yoshifumi Atarashi",1993-03-10,1994-03-03,1996-01-16,1996-01-16,https://patents.google.com/patent/US5485623A/en,https://patentimages.storage.googleapis.com/pages/US5485623-1.png
US-6389063-B1,"Signal transmission apparatus using an isolator, modem, and information processor ","Hitachi, Ltd.","Nobuyasu Kanekawa, Kazuo Kato, Yasuyuki Kojima, Seigoh Yukitake",1997-10-31,1998-10-30,2002-05-14,2002-05-14,https://patents.google.com/patent/US6389063B1/en,https://patentimages.storage.googleapis.com/71/30/d1/ed5ca7ce47bb7e/US06389063-20020514-D00000.png
US-6209131-B1,Apparatus and method for processing additional information in display device ,Lg Electronics Inc.,"Jae Ryong Kim, Sang Won Chung, Se Jung Sohn, Mun Youl Lee, Sung A Cho",1998-12-01,1999-11-05,2001-03-27,2001-03-27,https://patents.google.com/patent/US6209131B1/en,https://patentimages.storage.googleapis.com/7a/dd/03/5c9014f52360a2/US06209131-20010327-D00000.png
US-6239970-B1,"Cooling assisting device, cooling assisting method, electronic apparatus, and information processor ",Sony Corporation,"Yasuhiro Nakai, Yuzo Ozaki, Osamu Gomibuchi, Shigeyuki Hokao",1998-12-04,1999-12-03,2001-05-29,2001-05-29,https://patents.google.com/patent/US6239970B1/en,https://patentimages.storage.googleapis.com/ea/20/ad/6d5bee98363f40/US06239970-20010529-D00000.png
US-5001582-A,Apparatus for automatically changing an information storage medium ,Kabushiki Kaisha Toshiba,Takamoto Numasaki,1988-01-13,1989-01-03,1991-03-19,1991-03-19,https://patents.google.com/patent/US5001582A/en,https://patentimages.storage.googleapis.com/pages/US5001582-1.png
US-5900869-A,Information processor system allowing multi-user editing ,"Minolta Co., Ltd.",Kimihiko Higashio,1994-07-06,1997-11-19,1999-05-04,1999-05-04,https://patents.google.com/patent/US5900869A/en,https://patentimages.storage.googleapis.com/pages/US5900869-1.png
US-5630139-A,Program download type information processor ,Nec Corporation,Hirokazu Ozaki,1994-02-10,1995-02-08,1997-05-13,1997-05-13,https://patents.google.com/patent/US5630139A/en,https://patentimages.storage.googleapis.com/pages/US5630139-1.png
US-6138149-A,System for tracking information copied from a web page and sent via electronic mail ,Sony Corporation,Kazunori Ohmura,1997-06-05,1998-06-02,2000-10-24,2000-10-24,https://patents.google.com/patent/US6138149A/en,https://patentimages.storage.googleapis.com/pages/US6138149-1.png
US-5923339-A,Higher-speed parallel processing ,Canon Kabushiki Kaisha,"Atsushi Date, Kazumasa Hamaguchi, Masato Kosugi, Toshiyuki Fukui",1993-11-29,1997-11-26,1999-07-13,1999-07-13,https://patents.google.com/patent/US5923339A/en,https://patentimages.storage.googleapis.com/pages/US5923339-1.png
US-4499499-A,Method for identification and compression of facsimile symbols in text processing systems ,International Business Machines Corporation,"Norman F. Brickman, Walter S. Rosenbaum",1982-12-29,1982-12-29,1985-02-12,1985-02-12,https://patents.google.com/patent/US4499499A/en,https://patentimages.storage.googleapis.com/pages/US4499499-1.png
US-6118485-A,Card type camera with image processing function ,Sharp Kabushiki Kaisha,"Sadahiko Hinoue, Tetsuya Taki, Masako Nakanishi, Hiroyoshi Toda, Toyofumi Horikawa",1994-05-18,1997-11-24,2000-09-12,2000-09-12,https://patents.google.com/patent/US6118485A/en,https://patentimages.storage.googleapis.com/pages/US6118485-1.png
US-7120254-B2,Cryptographic system and method for geolocking and securing digital information ,Geocodex Llc,"Barry J. Glick, Ronald S. Karpf, Mark E. Seiler",2000-10-30,2001-01-10,2006-10-10,2006-10-10,https://patents.google.com/patent/US7120254B2/en,https://patentimages.storage.googleapis.com/US7120254B2/US07120254-20061010-D00000.png
US-6754637-B1,Method and apparatus to manage network based return processing ,Brian G. Stenz,Brian G. Stenz,2000-04-21,2000-04-21,2004-06-22,2004-06-22,https://patents.google.com/patent/US6754637B1/en,https://patentimages.storage.googleapis.com/aa/56/76/e87ed2078f9153/US06754637-20040622-D00000.png
US-4942391-A,Picture information composite system ,Nec Home Electronics Ltd.,Keiichi Kikuta,1987-08-31,1988-08-29,1990-07-17,1990-07-17,https://patents.google.com/patent/US4942391A/en,https://patentimages.storage.googleapis.com/pages/US4942391-1.png
US-6804791-B2,Data processing apparatus ,"Matsushita Electric Industrial Co., Ltd.","Mitsuaki Oshima, Yoshihiro Gohara, Yoshinori Kobayashi, Shozo Fujiwara, Tsuyoshi Uemura",1990-03-23,2002-07-24,2004-10-12,2004-10-12,https://patents.google.com/patent/US6804791B2/en,https://patentimages.storage.googleapis.com/44/39/45/af636d02bfd63a/US06804791-20041012-D00000.png
US-5706402-A,Blind signal processing system employing information maximization to recover unknown signals through unsupervised minimization of output redundancy ,The Salk Institute For Biological Studies,Anthony J. Bell,1994-11-29,1994-11-29,1998-01-06,1998-01-06,https://patents.google.com/patent/US5706402A/en,https://patentimages.storage.googleapis.com/pages/US5706402-2.png
US-6058415-A,System and method for integration of communication systems with computer-based information systems ,Intervoice Limited Partnership,Michael J. Polcyn,1997-07-24,1997-07-24,2000-05-02,2000-05-02,https://patents.google.com/patent/US6058415A/en,https://patentimages.storage.googleapis.com/pages/US6058415-1.png
US-6691068-B1,"Methods and apparatus for obtaining data for process operation, optimization, monitoring, and control ","Onwafer Technologies, Inc.","Mason L. Freed, Randall S. Mundt, Costas J. Spanos",2000-08-22,2000-08-22,2004-02-10,2004-02-10,https://patents.google.com/patent/US6691068B1/en,https://patentimages.storage.googleapis.com/a4/19/cd/bab1731cd8ebf9/US06691068-20040210-D00000.png
US-7155604-B2,Game system having selectable startup display image wherein system processor selects between internal display image or display image from external memory card ,Sony Computer Entertainment Inc.,Eiji Kawai,1998-07-31,1999-07-30,2006-12-26,2006-12-26,https://patents.google.com/patent/US7155604B2/en,https://patentimages.storage.googleapis.com/US7155604B2/US07155604-20061226-D00000.png
US-6043980-A,Heat sink and information processor using it ,Fujitsu Limited,Tadashi Katsui,1997-02-24,1997-12-31,2000-03-28,2000-03-28,https://patents.google.com/patent/US6043980A/en,https://patentimages.storage.googleapis.com/pages/US6043980-1.png
US-5410676-A,Information system using designating areas for retrieving/converting data and directories of different formats storing in optical and magnetic storage ,The Regents Of The University Of California,"Han K. Huang, Craig A. Morioka, Osman Ratib, Paul N. S. Cho, Bruce K. T. Ho, Takeo Sonobe, Toru Shinagawa",1989-08-31,1992-10-27,1995-04-25,1995-04-25,https://patents.google.com/patent/US5410676A/en,https://patentimages.storage.googleapis.com/pages/US5410676-1.png
US-6285328-B1,Antenna arrangement of an information processor ,Kabushiki Kaisha Toshiba,"Toshiyuki Masaki, Koichi Kobayashi, Yoshinori Horiguchi, Toshiki Miyasaka, Hiroki Iwahara, Syuichi Sekine",1998-12-08,1999-12-07,2001-09-04,2001-09-04,https://patents.google.com/patent/US6285328B1/en,https://patentimages.storage.googleapis.com/4d/58/b7/d57758edb82429/US06285328-20010904-D00000.png
US-6822758-B1,"Image processing method, system and computer program to improve an image sensed by an image sensing apparatus and processed according to a conversion process ",Canon Kabushiki Kaisha,Takashi Morino,1998-07-01,1999-06-29,2004-11-23,2004-11-23,https://patents.google.com/patent/US6822758B1/en,https://patentimages.storage.googleapis.com/f4/45/78/62565b2b83cc85/US06822758-20041123-D00000.png
US-5829003-A,"Record processing apparatus, method and computer readable storage having attribute information representing a hierarchical connection for display of data ","Casio Computer Co., Ltd.",Osamu Okura,1995-05-23,1996-05-13,1998-10-27,1998-10-27,https://patents.google.com/patent/US5829003A/en,https://patentimages.storage.googleapis.com/pages/US5829003-1.png
