CN-107203808-B,Species binary convolution means and the corresponding binary convolutional neural network processor ,中国科学院计算技术研究所,"韩银和, 许浩博, 王颖",2017-05-08,2017-05-08,2018-06-01,2018-06-01,https://patents.google.com/patent/CN107203808B/en,
CN-107153873-B,Species binary convolutional neural network processor and method of use ,中国科学院计算技术研究所,"韩银和, 许浩博, 王颖",2017-05-08,2017-05-08,2018-06-01,2018-06-01,https://patents.google.com/patent/CN107153873B/en,
US-2018129935-A1,Convolutional neural network system and operation method thereof ,Electronics And Telecommunications Research Institute,"Jin Kyu Kim, Byung Jo Kim, Seong Min Kim, Ju-Yeob Kim, Mi Young Lee, Joo Hyun Lee",2016-11-07,2017-11-07,2018-05-10,,https://patents.google.com/patent/US20180129935A1/en,https://patentimages.storage.googleapis.com/8f/da/82/8a5a9cb7878f7c/US20180129935A1-20180510-D00000.png
US-2018129974-A1,Control systems using deep reinforcement learning ,United Technologies Corporation,"Michael J. Giering, Kishore K. Reddy, Vivek Venugopalan, Amit Surana, Soumalya Sarkar",2016-11-04,2017-10-30,2018-05-10,,https://patents.google.com/patent/US20180129974A1/en,https://patentimages.storage.googleapis.com/6f/15/98/8bd2ee9911863a/US20180129974A1-20180510-D00000.png
US-2018033449-A1,System and method for performing speech enhancement using a neural network-based combined symbol ,Apple Inc.,"Lalin S. Theverapperuma, Vasu Iyengar, Sarmad Aziz Malik, Raghavendra Prabhu",2016-08-01,2016-08-01,2018-02-01,,https://patents.google.com/patent/US20180033449A1/en,https://patentimages.storage.googleapis.com/0e/53/cb/c0f389dda9d217/US20180033449A1-20180201-D00000.png
US-2018173971-A1,Pedestrian detection neural networks ,Waymo Llc,"Zhaoyin Jia, Ury Zhilinsky, Yun Jiang, Yimeng Zhang",2016-12-19,2016-12-19,2018-06-21,,https://patents.google.com/patent/US20180173971A1/en,https://patentimages.storage.googleapis.com/1b/2b/5b/889d4b19af8e2f/US20180173971A1-20180621-D00000.png
US-2017323199-A1,Method and system for training and neural network models for large number of discrete features for information rertieval ,Baidu Usa Llc,Shuang Wu,2016-05-05,2016-05-05,2017-11-09,,https://patents.google.com/patent/US20170323199A1/en,https://patentimages.storage.googleapis.com/06/92/e1/0a4bb19caf0f1d/US20170323199A1-20171109-D00000.png
US-2018240031-A1,Active learning system ,"Twitter, Inc.","Ferenc Huszar, Pietro Berkes, Zehan Wang",2017-02-17,2018-01-22,2018-08-23,,https://patents.google.com/patent/US20180240031A1/en,https://patentimages.storage.googleapis.com/fe/b3/f9/62bd0658637ec8/US20180240031A1-20180823-D00000.png
US-2018240017-A1,Difference metric for machine learning-based processing systems ,"Twitter, Inc.","Ferenc Huszar, Lucas Theis, Pietro Berkes",2017-02-17,2017-12-27,2018-08-23,,https://patents.google.com/patent/US20180240017A1/en,https://patentimages.storage.googleapis.com/ce/1e/23/369c85222dc0f4/US20180240017A1-20180823-D00000.png
US-2018075341-A1,Regularization of neural networks ,International Business Machines Corporation,"Sakyasingha Dasgupta, Takayuki Osogami",2016-09-09,2016-12-28,2018-03-15,,https://patents.google.com/patent/US20180075341A1/en,https://patentimages.storage.googleapis.com/57/a7/1b/a9c0d865c5e1b2/US20180075341A1-20180315-D00000.png
US-2018121796-A1,Flexible neural network accelerator and methods therefor ,Intel Corporation,"Michael E Deisher, Ohad Falik",2016-11-03,2016-11-03,2018-05-03,,https://patents.google.com/patent/US20180121796A1/en,https://patentimages.storage.googleapis.com/b2/c0/9d/a428e9c518c83d/US20180121796A1-20180503-D00000.png
US-2018089562-A1,Operation apparatus and method for convolutional neural network ,SK Hynix Inc.,"Young-Jae JIN, Young-Suk Moon, Hong-Sik Kim",2016-09-28,2017-06-09,2018-03-29,,https://patents.google.com/patent/US20180089562A1/en,https://patentimages.storage.googleapis.com/e7/6a/77/23a98921256a76/US20180089562A1-20180329-D00000.png
US-2018068215-A1,Big data processing method for segment-based two-grade deep learning model ,"Institute Of Acoustics, Chinese Academy Of Sciences, Shanghai 3Ntv Network Technology Co. Ltd.","Jinlin Wang, Jiali You, Yiqiang SHENG, Chaopeng Li",2015-03-13,2015-03-31,2018-03-08,,https://patents.google.com/patent/US20180068215A1/en,https://patentimages.storage.googleapis.com/a4/b4/35/4ca2546577519c/US20180068215A1-20180308-D00000.png
CN-106096728-B,Based on deep species on Extreme Learning Machine hazard identification method ,南京航空航天大学,"周良, 李诗瑶, 谢强, 王增臣",2016-06-03,2016-06-03,2018-08-24,2018-08-24,https://patents.google.com/patent/CN106096728B/en,
US-2018046910-A1,Deep Machine Learning to Predict and Prevent Adverse Conditions at Structural Assets ,Google Inc.,Michael Greene,2016-08-10,2016-08-10,2018-02-15,,https://patents.google.com/patent/US20180046910A1/en,https://patentimages.storage.googleapis.com/97/05/3b/bc2c451294b89c/US20180046910A1-20180215-D00000.png
US-2016284347-A1,Processing audio waveforms ,Google Inc.,"Tara N. Sainath, Ron J. Weiss, Andrew W. Senior, Kevin William Wilson",2015-03-27,2016-03-25,2016-09-29,,https://patents.google.com/patent/US20160284347A1/en,https://patentimages.storage.googleapis.com/3b/44/0f/31f5e49ae41038/US20160284347A1-20160929-D00000.png
US-2016217369-A1,Model compression and fine-tuning ,Qualcomm Incorporated,"Venkata Sreekanta Reddy ANNAPUREDDY, Daniel Hendricus Franciscus DIJKMAN, David Jonathan Julian",2015-01-22,2015-09-04,2016-07-28,,https://patents.google.com/patent/US20160217369A1/en,https://patentimages.storage.googleapis.com/2b/11/80/1f535695a123d8/US20160217369A1-20160728-D00000.png
US-2016364522-A1,"Systems and methods for classifying, prioritizing and interpreting genetic variants and therapies using a deep neural network ",Deep Genomics Incorporated,"Brendan Frey, Michael K.K. LEUNG, Andrew Thomas DELONG, Hui Yuan XIONG, Babak ALIPANAHI, Leo J. Lee, Hannes BRETSCHNEIDER",2015-06-15,2015-06-15,2016-12-15,,https://patents.google.com/patent/US20160364522A1/en,https://patentimages.storage.googleapis.com/7d/92/f1/114af0d37c9ce3/US20160364522A1-20161215-D00001.png
US-2016342623-A1,Mobile visual search using deep variant coding ,Yahoo! Inc.,"JenHao Hsiao, Jia Li",2015-05-18,2015-05-18,2016-11-24,,https://patents.google.com/patent/US20160342623A1/en,https://patentimages.storage.googleapis.com/a6/58/8d/9de85e00b4826e/US20160342623A1-20161124-D00000.png
CN-107341447-A,Face verification method based on deep convolutional neural network and evidence K nearest neighbor ,华南理工大学,"傅予力, 黄志建, 吴小思, 张隆琴",2017-06-13,2017-06-13,2017-11-10,,https://patents.google.com/patent/CN107341447A/en,
US-2016104058-A1,Generic object detection in images ,"Microsoft Technology Licensing, Llc","Kaiming He, Jian Sun, Xiangyu ZHANG",2014-10-09,2015-02-09,2016-04-14,,https://patents.google.com/patent/US20160104058A1/en,https://patentimages.storage.googleapis.com/a3/53/06/dc61929e713ad0/US20160104058A1-20160414-D00000.png
US-2018089834-A1,Neural network for eye image segmentation and image quality estimation ,"Magic Leap, Inc.","Alexey SPIZHEVOY, Adrian Kaehler, Vijay Badrinarayanan",2016-09-29,2017-05-25,2018-03-29,,https://patents.google.com/patent/US20180089834A1/en,https://patentimages.storage.googleapis.com/01/d0/f5/17dc398d5b5182/US20180089834A1-20180329-D00000.png
US-2018059679-A1,Depth map estimation with stereo images ,"Ford Global Technologies, Llc","Vahid Taimouri, Michel Cordonnier, Kyoung Min Lee, Bryan Roger Goodman, Gintaras Vincent Puskorius",2016-09-01,2016-09-01,2018-03-01,,https://patents.google.com/patent/US20180059679A1/en,https://patentimages.storage.googleapis.com/e0/23/af/f31e7f9424aa81/US20180059679A1-20180301-D00000.png
WO-2018076475-A1,"Photovoltaic assembly accelerated degradation model established based on deep approach of learning, and method for predicting photovoltaic assembly lifetime ",广东产品质量监督检验研究院,"余荣斌, 刘桂雄, 徐欢",2016-10-26,2016-12-09,2018-05-03,,https://patents.google.com/patent/WO2018076475A1/en,https://patentimages.storage.googleapis.com/68/55/c4/45ac76638f79fb/PCTCN2016109121-appb-300001.png
US-2014313303-A1,Longitudinal dermoscopic study employing smartphone-based image registration ,Digimarc Corporation,"Bruce L. Davis, Tony F. Rodriguez, Geoffrey B. Rhoads",2013-04-18,2014-05-28,2014-10-23,,https://patents.google.com/patent/US20140313303A1/en,https://patentimages.storage.googleapis.com/c1/a9/f4/3b5aa7334107d7/US20140313303A1-20141023-D00000.png
US-2018218497-A1,Automated segmentation utilizing fully convolutional networks ,Arterys Inc.,"Daniel Irving GOLDEN, Matthieu Le, Jesse Lieman-Sifry, Hok Kan Lau",2017-01-27,2018-01-25,2018-08-02,,https://patents.google.com/patent/US20180218497A1/en,https://patentimages.storage.googleapis.com/b0/cf/ae/fe185fce8c772a/US20180218497A1-20180802-D00000.png
US-2017351941-A1,System and Method for Performing Saliency Detection Using Deep Active Contours ,Miovision Technologies Incorporated,"Akshaya K. MISHRA, Zhiming LUO, Andrew J. ACHKAR, Justin A. EICHEL",2016-06-03,2017-05-31,2017-12-07,,https://patents.google.com/patent/US20170351941A1/en,https://patentimages.storage.googleapis.com/b7/64/37/f511d28dc75640/US20170351941A1-20171207-D00000.png
US-2018157969-A1,Apparatus and Method for Achieving Accelerator of Sparse Convolutional Neural Network ,"Beijing Deephi Technology Co., Ltd.","Dongliang XIE, Yu Zhang, Yi Shan",2016-12-05,2017-12-05,2018-06-07,,https://patents.google.com/patent/US20180157969A1/en,https://patentimages.storage.googleapis.com/fd/c3/65/922c1dd88a1ee0/US20180157969A1-20180607-D00000.png
US-2017300814-A1,Wide and deep machine learning models ,Google Inc.,"Tal Shaked, Rohan Anil, Hrishikesh Balkrishna Aradhye, Mustafa ispir, Glen Anderson, Wei Chai, Mehmet Levent Koc, Jeremiah Harmsen, Xiaobing LIU, Gregory Sean Corrado, Tushar Deepak Chandra, Heng-Tze Cheng",2016-04-13,2016-12-29,2017-10-19,,https://patents.google.com/patent/US20170300814A1/en,https://patentimages.storage.googleapis.com/05/3c/fb/5f71528d4c2a59/US20170300814A1-20171019-D00000.png
US-2018260951-A1,Deep Image-to-Image Recurrent Network with Shape Basis for Automatic Vertebra Labeling in Large-Scale 3D CT Volumes ,Siemens Healthcare Gmbh,"Dong Yang, Tao Xiong, Daguang Xu, Shaohua Kevin Zhou, Mingqing Chen, Zhoubing XU, Dorin Comaniciu, Jin-hyeong Park",2017-03-08,2018-02-02,2018-09-13,,https://patents.google.com/patent/US20180260951A1/en,https://patentimages.storage.googleapis.com/d8/2f/8b/7b23accac88352/US20180260951A1-20180913-D00000.png
US-2018089505-A1,System and method for deep network fusion for fast and robust object detection ,"Samsung Electronics Co., Ltd.","Mostafa El-Khamy, Xianzhi Du, Jungwon Lee",2016-09-23,2017-02-16,2018-03-29,,https://patents.google.com/patent/US20180089505A1/en,https://patentimages.storage.googleapis.com/61/c9/80/527e2ee706e08c/US20180089505A1-20180329-D00000.png
US-2018121802-A1,Method of converting neural network and recognition apparatus using the same ,"Samsung Electronics Co., Ltd., Universitaet Zuerich","Bodo RUCKAUER, Iulia-Alexandra LUNGU, Yuhuang HU, Michael Pfeiffer",2016-11-02,2017-06-23,2018-05-03,,https://patents.google.com/patent/US20180121802A1/en,https://patentimages.storage.googleapis.com/50/4b/1a/7d47945ec5c780/US20180121802A1-20180503-D00000.png
US-2014378810-A1,Physiologic data acquisition and analysis ,Digimarc Corporation,"Bruce L. Davis, Tony F. Rodriguez, Alastair M. Reed, John Stach, Geoffrey B. Rhoads, William Y. Conwell, Shankar Thagadur Shivappa, Ravi K. Sharma, Richard F. Gibson",2013-04-18,2014-05-13,2014-12-25,,https://patents.google.com/patent/US20140378810A1/en,https://patentimages.storage.googleapis.com/97/db/de/008057b1778831/US20140378810A1-20141225-D00000.png
US-2015055783-A1,"Statistical modelling, interpolation, measurement and anthropometry based prediction of head-related transfer functions ",University Of Maryland,"Yuancheng Luo, Ramani Duraiswami, Dmitry N. Zotkin",2013-05-24,2014-05-27,2015-02-26,,https://patents.google.com/patent/US20150055783A1/en,https://patentimages.storage.googleapis.com/8c/84/5a/9d72d3ad6aa622/US20150055783A1-20150226-D00000.png
US-2017169815-A1,System and methods for adapting neural network acoustic models ,"Nuance Communications, Inc.","Puming Zhan, Xinwei Li",2015-12-10,2015-12-10,2017-06-15,,https://patents.google.com/patent/US20170169815A1/en,https://patentimages.storage.googleapis.com/ee/ca/8c/04b68a3c80b298/US20170169815A1-20170615-D00000.png
US-5696883-A,Neural network expressing apparatus including refresh of stored synapse load value information ,Mitsubishi Denki Kabushiki Kaisha,Yutaka Arima,1992-01-24,1992-11-03,1997-12-09,1997-12-09,https://patents.google.com/patent/US5696883A/en,https://patentimages.storage.googleapis.com/pages/US5696883-1.png
US-2017173262-A1,"Medical systems, devices and methods ",François Paul VELTZ,François Paul VELTZ,2017-03-01,2017-03-01,2017-06-22,,https://patents.google.com/patent/US20170173262A1/en,https://patentimages.storage.googleapis.com/66/80/df/5950afff15ba24/US20170173262A1-20170622-D00000.png
US-2004133531-A1,Neural network training data selection using memory reduced cluster analysis for field model development ,"Dingding Chen, Quirein John A., Wiener Jacky M., Grable Jeffery L., Syed Hamid, Smith Harry D.","Dingding Chen, John Quirein, Jacky Wiener, Jeffery Grable, Syed Hamid, Harry Smith",2003-01-06,2003-03-21,2004-07-08,,https://patents.google.com/patent/US20040133531A1/en,https://patentimages.storage.googleapis.com/2e/25/4a/f55a221b3075aa/US20040133531A1-20040708-D00000.png
US-2015125049-A1,Systems and methods for facial representation ,"Facebook, Inc.","Yaniv Taigman, Ming Yang, Marc'aurelio Ranzato",2013-11-04,2014-10-31,2015-05-07,,https://patents.google.com/patent/US20150125049A1/en,https://patentimages.storage.googleapis.com/23/ef/05/08b0be9e2eb30e/US20150125049A1-20150507-D00000.png
US-5572028-A,Multi-element dosimetry system using neural network ,Saint-Gobain/Norton Industrial Ceramics Corporation,"Marko Moscovitch, Joseph E. Rotunda",1994-10-20,1994-10-20,1996-11-05,1996-11-05,https://patents.google.com/patent/US5572028A/en,https://patentimages.storage.googleapis.com/pages/US5572028-1.png
US-2016196488-A1,"Neural network computing device, system and method ",Byungik Ahn,Byungik Ahn,2013-08-02,2014-07-31,2016-07-07,,https://patents.google.com/patent/US20160196488A1/en,https://patentimages.storage.googleapis.com/cd/61/d9/65175153a0e205/US20160196488A1-20160707-D00000.png
US-9141916-B1,Using embedding functions with a deep network ,Google Inc.,"Gregory S. Corrado, Kai Chen, Jeffrey A. Dean, Gary R. Holt, Julian P. Grady, Sharat Chikkerur, David W. Sculley",2012-06-29,2013-03-14,2015-09-22,2015-09-22,https://patents.google.com/patent/US9141916B1/en,https://patentimages.storage.googleapis.com/6e/72/68/b57342340667fb/US09141916-20150922-D00000.png
US-9690938-B1,Methods and apparatus for machine learning based malware detection ,"Invincea, Inc.","Joshua Daniel Saxe, Konstantin Berlin",2015-08-05,2016-08-04,2017-06-27,2017-06-27,https://patents.google.com/patent/US9690938B1/en,https://patentimages.storage.googleapis.com/5e/83/c8/42841cb2e60fb6/US09690938-20170627-D00000.png
CN-103544506-A,Method and device for classifying images on basis of convolutional neural network ,Tcl集团股份有限公司,"周龙沙, 邵诗强",2013-10-12,2013-10-12,2014-01-29,,https://patents.google.com/patent/CN103544506A/en,
US-2015161993-A1,Systems and methods for applying speaker adaption techniques to correlated features ,International Business Machines Corporation,"Tara N. Sainath, George A. Saon",2013-12-06,2014-06-25,2015-06-11,,https://patents.google.com/patent/US20150161993A1/en,https://patentimages.storage.googleapis.com/91/24/02/13672e591350b5/US20150161993A1-20150611-D00000.png
US-2014278426-A1,Data shredding for speech recognition acoustic model training under data retention restrictions ,"Nuance Communications, Inc.","Uwe Helmut Jost, Philip Charles Woodland, Marcel Katz, Syed Raza Shahid, Paul J. Vozila, William F. Ganong, III",2013-03-13,2013-03-13,2014-09-18,,https://patents.google.com/patent/US20140278426A1/en,https://patentimages.storage.googleapis.com/3b/37/01/c21042cf7a9bf8/US20140278426A1-20140918-D00000.png
US-2016098844-A1,"Systems, methods, and computer program products for searching and sorting images by aesthetic quality ",EyeEm Mobile GmbH,"Appu Shaji, Ramzi Rizk",2014-10-03,2015-05-29,2016-04-07,,https://patents.google.com/patent/US20160098844A1/en,https://patentimages.storage.googleapis.com/d1/a1/33/1eeccae5a93034/US20160098844A1-20160407-D00000.png
US-5568590-A,Image processing using genetic mutation of neural network parameters ,Xaos Tools,Michael Tolson,1993-12-17,1993-12-17,1996-10-22,1996-10-22,https://patents.google.com/patent/US5568590A/en,https://patentimages.storage.googleapis.com/pages/US5568590-1.png
US-2014149112-A1,Combining auditory attention cues with phoneme posterior scores for phone/vowel/syllable boundary detection ,Sony Computer Entertainment Inc.,Ozlem Kalinli-Akbacak,2012-11-29,2013-05-23,2014-05-29,,https://patents.google.com/patent/US20140149112A1/en,https://patentimages.storage.googleapis.com/21/6c/ad/b910f49114970d/US20140149112A1-20140529-D00000.png
US-2018276528-A1,Image Retrieval Method Based on Variable-Length Deep Hash Learning ,Sun Yat-Sen University,"Liang Lin, Ruimao Zhang, Qing Wang, Bo Jiang",2015-12-03,2018-05-25,2018-09-27,,https://patents.google.com/patent/US20180276528A1/en,https://patentimages.storage.googleapis.com/4a/30/f9/0fd47d59623723/US20180276528A1-20180927-D00000.png
US-2018181838-A1,Convolutional neural network system and operation method thereof ,"Samsung Electronics Co., Ltd.",Seung-Soo Yang,2016-12-22,2017-11-03,2018-06-28,,https://patents.google.com/patent/US20180181838A1/en,https://patentimages.storage.googleapis.com/d1/10/7e/fcf8126fffd4b1/US20180181838A1-20180628-D00000.png
US-5548684-A,Artificial neural network viterbi decoding system and method ,Georgia Tech Research Corporation,"Xiao-an Wang, Stephen B. Wicker",1994-04-22,1994-04-22,1996-08-20,1996-08-20,https://patents.google.com/patent/US5548684A/en,https://patentimages.storage.googleapis.com/pages/US5548684-2.png
US-2016078339-A1,Learning Student DNN Via Output Distribution ,"Microsoft Technology Licensing, Llc","Jinyu Li, Rui Zhao, Jui-Ting Huang, Yifan Gong",2014-09-12,2015-09-14,2016-03-17,,https://patents.google.com/patent/US20160078339A1/en,https://patentimages.storage.googleapis.com/3b/29/a6/43cd23bd7f73ef/US20160078339A1-20160317-D00000.png
US-2017108236-A1,Environment control system ,Lucis Technologies Holding Limited,"Shan Guan, Tao Zhao",2015-04-03,2015-05-29,2017-04-20,,https://patents.google.com/patent/US20170108236A1/en,https://patentimages.storage.googleapis.com/58/6e/92/51b64716438553/US20170108236A1-20170420-D00000.png
CN-103400577-A,Acoustic model building method and device for multi-language voice identification ,百度在线网络技术（北京）有限公司,"苏丹, 尹钊",2013-08-01,2013-08-01,2013-11-20,,https://patents.google.com/patent/CN103400577A/en,
US-2016098386-A1,System and method for unsupervised text normalization using distributed representation of words ,"At&T Intellectual Property I, L.P.",Vivek Kumar RANGARAJAN SRIDHAR,2014-10-03,2014-10-03,2016-04-07,,https://patents.google.com/patent/US20160098386A1/en,https://patentimages.storage.googleapis.com/b2/c5/2b/39448f0cc32028/US20160098386A1-20160407-D00000.png
US-2015199963-A1,Mobile speech recognition hardware accelerator ,Google Inc.,Juha-Pekka Maaninen,2012-10-23,2012-10-23,2015-07-16,,https://patents.google.com/patent/US20150199963A1/en,https://patentimages.storage.googleapis.com/ee/43/28/03ff8f47df481b/US20150199963A1-20150716-D00000.png
US-7333963-B2,Cognitive memory and auto-associative neural network based search engine for computer and network located images and photographs ,"Bernard Widrow, Juan Carlos Aragon, Brian Mitchell Percival","Bernard Widrow, Juan Carlos Aragon, Brian Mitchell Percival",2004-10-07,2005-10-07,2008-02-19,2008-02-19,https://patents.google.com/patent/US7333963B2/en,https://patentimages.storage.googleapis.com/0b/a4/e2/cf61cf8bad97e9/US07333963-20080219-D00001.png
US-2016148078-A1,Convolutional Neural Network Using a Binarized Convolution Layer ,Adobe Systems Incorporated,"Xiaohui SHEN, Haoxiang Li, Zhe Lin, Jonathan W. Brandt",2014-11-20,2014-11-20,2016-05-26,,https://patents.google.com/patent/US20160148078A1/en,https://patentimages.storage.googleapis.com/33/0b/4f/563b5208a5b33e/US20160148078A1-20160526-D00000.png
CN-104463172-A,Face feature extraction method based on face feature point shape drive depth model ,中国科学院重庆绿色智能技术研究院,"刘艳飞, 程诚, 周祥东, 周曦",2014-12-09,2014-12-09,2015-03-25,,https://patents.google.com/patent/CN104463172A/en,
US-2012056800-A1,"System for fast, probabilistic skeletal tracking ",Microsoft Corporation,"Oliver Williams, Ryan Geiss",2010-09-07,2010-09-07,2012-03-08,,https://patents.google.com/patent/US20120056800A1/en,https://patentimages.storage.googleapis.com/e7/58/f0/73708c8cc10ed1/US20120056800A1-20120308-D00000.png
US-2009106223-A1,Enterprise relevancy ranking using a neural network ,Microsoft Corporation,"Dmitriy Meyerzon, Yauhen Shnitko, Chris J.C. Burges, Michael James Taylor",2007-10-18,2007-10-18,2009-04-23,,https://patents.google.com/patent/US20090106223A1/en,
US-2012016435-A1,Optimal deep brain stimulation therapy with q learning ,Sorin Crm Sas,Rami Rom,2009-03-22,2010-03-18,2012-01-19,,https://patents.google.com/patent/US20120016435A1/en,https://patentimages.storage.googleapis.com/e1/49/70/c09daa9a214197/US20120016435A1-20120119-D00000.png
US-2016358619-A1,Multi-Microphone Speech Recognition Systems and Related Techniques ,Apple Inc.,"Sean A. Ramprashad, Harvey D. Thornburg, Arvindh KRISHNASWAMY, Aram M. Lindahl",2015-06-06,2015-06-06,2016-12-08,,https://patents.google.com/patent/US20160358619A1/en,https://patentimages.storage.googleapis.com/ee/fe/18/88782168e7f406/US20160358619A1-20161208-D00000.png
US-2007011114-A1,Ensembles of neural networks with different input sets ,"Halliburton Energy Services, Inc.","Dingding Chen, John Quirein, Harry Smith, Syed Hamid, Jeffery Grable",2005-06-24,2005-06-24,2007-01-11,,https://patents.google.com/patent/US20070011114A1/en,https://patentimages.storage.googleapis.com/ab/35/1e/a7d3a3bb5c099b/US20070011114A1-20070111-D00000.png
US-2012254086-A1,"Deep convex network with joint use of nonlinear random projection, restricted boltzmann machine and batch-based parallelizable optimization ",Microsoft Corporation,"Li Deng, Dong Yu, Alejandro Acero",2011-03-31,2011-03-31,2012-10-04,,https://patents.google.com/patent/US20120254086A1/en,https://patentimages.storage.googleapis.com/da/27/95/e04d7042e8425f/US20120254086A1-20121004-D00000.png
CN-104077595-A,Deep belief network image recognition method based on Bayesian regularization ,北京工业大学,"乔俊飞, 潘广源, 韩红桂, 柴伟",2014-06-15,2014-06-15,2014-10-01,,https://patents.google.com/patent/CN104077595A/en,
RU-2424561-C2,Training convolutional neural network on graphics processing units ,Майкрософт Корпорейшн,"Сиддхарта ПУРИ (US), Сиддхарта ПУРИ",2005-08-31,2006-08-17,2011-07-20,2011-07-20,https://patents.google.com/patent/RU2424561C2/en,https://patentimages.storage.googleapis.com/ce/9a/fe/e26afa8a0f18e8/00000119.png
US-2016054452-A1,System and Method for Detecting Objects Obstructing a Driver's View of a Road ,"Nec Laboratories America, Inc.","Eric Cosatto, Hans Peter Graf",2014-08-20,2015-08-20,2016-02-25,,https://patents.google.com/patent/US20160054452A1/en,https://patentimages.storage.googleapis.com/2f/59/19/491d120caf6085/US20160054452A1-20160225-D00000.png
US-2017236512-A1,Processing spoken commands to control distributed audio outputs ,"Amazon Technologies, Inc.","Robert Williams, Steven Todd Rabuchin, Gregory Michael Hart",2016-02-12,2016-03-29,2017-08-17,,https://patents.google.com/patent/US20170236512A1/en,https://patentimages.storage.googleapis.com/6b/a5/b3/47e2b778fd5e8b/US20170236512A1-20170817-D00000.png
US-2015127327-A1,Context-dependent state tying using a neural network ,Google Inc.,"Michiel A.U. Bacchiani, David Rybach",2013-11-01,2014-05-20,2015-05-07,,https://patents.google.com/patent/US20150127327A1/en,https://patentimages.storage.googleapis.com/ed/61/a6/f54aa4edc26310/US20150127327A1-20150507-D00000.png
US-2017053169-A1,Object detection and analysis via unmanned aerial vehicle ,"Motionloft, Inc.","Mark Cuban, Joyce Reitman, Jeffrey Orion Pritchard",2015-08-20,2015-08-20,2017-02-23,,https://patents.google.com/patent/US20170053169A1/en,https://patentimages.storage.googleapis.com/14/85/e2/8c378c87f92781/US20170053169A1-20170223-D00000.png
US-8306931-B1,"Detecting, classifying, and tracking abnormal data in a data stream ","Data Fusion & Neural Networks, LLC","Christopher Bowman, Duane DeSieno",2009-08-06,2009-08-06,2012-11-06,2012-11-06,https://patents.google.com/patent/US8306931B1/en,https://patentimages.storage.googleapis.com/14/09/c7/0f51e60a088ac4/US08306931-20121106-D00000.png
US-2016299685-A1,Neural network for keyboard input decoding ,Google Inc.,"Shumin Zhai, Thomas Breuel, Ouais Alsharif, Yu Ouyang, Francoise Beaufays, Johan Schalkwyk",2015-04-10,2015-04-10,2016-10-13,,https://patents.google.com/patent/US20160299685A1/en,https://patentimages.storage.googleapis.com/6f/73/f5/4281ef64d2fe7f/US20160299685A1-20161013-D00000.png
US-2016179844-A1,Neural Network Image Curation Control ,Adobe Systems Incorporated,"Xiaohui SHEN, Xin Lu, Zhe Lin, Radomir Mech",2014-12-17,2014-12-17,2016-06-23,,https://patents.google.com/patent/US20160179844A1/en,https://patentimages.storage.googleapis.com/6d/67/2a/f636b3b033aff1/US20160179844A1-20160623-D00000.png
